index	year	month	location	news
62552	2011	9	pakistan	The US Chairman of the Joint Chiefs of Staff (CJCS) Admiral Mike Mullen on September 22 accused Pakistan of “exporting” violent extremism to Afghanistan by backing militants that attack American and NATO troops, reports Daily Times. He said Inter Services Intelligence (ISI) was actively supporting Haqqani network militants blamed for an assault on the US embassy in Kabul on September 13. “The Haqqani network, for one, acts as a veritable arm of Pakistan’s Inter Services Intelligence agency,” Mullen told the US Senate Armed Services Committee. “In choosing to use violent extremism as an instrument of policy, the government of Pakistan and most especially the Pakistani Army and ISI jeopardises not only the prospect of our strategic partnership, but also Pakistan’s opportunity to be a respected nation with legitimate regional influence,” he said. “By exporting violence, they have eroded their internal security and their position in the region. They have undermined their international credibility and threatened their economic well being”, he added.
61454	2011	7	pakistan	At least five Frontier Corps (FC) personnel were killed and six injured when their vehicle hit an Improvised Explosive Device (IED) in Tumpt Gozani area of Mand tehsil (revenue unit) in Turbat District near the Iranian border on July 5, reports Dawn. The Baloch Liberation Front (BLF) claimed responsibility for the attack.
11379	2014	6	bangladesh	The High Court (HC) on June 9 summoned Jamaat e Islami (JeI) acting secretary general Rafiqul Islam Khan before it on July 7, 2014 in connection with a contempt of court rule issued for making a derogatory and contemptuous statement about the court, reports Daily Excelsior. The bench of Justice Mohammad Asfaqul Islam and Justice Mohammad Ashraful Kamal also fixed July 7 for delivering a verdict on this issue. Earlier, on August 5, 2013 another HC bench, led by Justice M Enayetur Rahim, issued the contempt rule against Rafiqul and another JeI leader, Mohammad Ibrahim, for issuing the statement on August 1, 2013 rejecting the HC verdict that declared JeI s registration with the Election Commission illegal. Receiving a copy of the statement, the HC bench led by Justice Enayetur on August 5 also asked them to appear before it on September 16 last year to explain why contempt of court proceedings should not be brought against them for issuing such a statement. Rafiqul and Ibrahim apologised unconditionally to the court for the statement and Ibrahim appeared before the HC but Rafiqul did not, Deputy Attorney General SM Maniruzzaman said.
34417	2013	9	pakistan	Police on September 2 registered murder charges against former President General (retired) Pervez Musharraf in connection with the death of a radical cleric, Abdul Rashid Ghazi, during the siege of Lal Masjid (Red Mosque) in July 2007, reports Daily Times. Radical cleric Abdul Rashid Ghazi was one of more than 100 people killed after troops stormed the Red Mosque in Islamabad on July 10, 2007. “The High Court ordered Islamabad Police to register murder charges against Musharraf on a petition filed by the son of Rashid Ghazi,” said Tariq Asad, a lawyer who represented Ghazi in court. “We have booked Musharraf under section 302 119 of the law, which deals with murder charges,” Qasim Niazi, a senior Police Official said.
8684	2015	7	pakistan	The paramilitary forces, deployed at the Joudhar check post in Panjgur District, signaled a vehicle to stop. Instead two suspected militants opened fire on them and tried to speed away. The security personnel returned fire and arrested them with bullet injuries reports The Express Tribune. One RPG7 with two magazines and SMGs rounds were seized from their possession, he added.
4867	2015	8	india	Minister of State for Home Affairs Haribhai Parathibhai Chaudhary said in a written reply to Lok Sabha (Lower House) on August 11 said that Pakistan violated ceasefire 192 times along the international Border (IB) in Jammu Kashmir till July 26, 2015, reports Times of India. In 2015, till July 26, there were 192 ceasefire violations along the international border in J K, which resulted in death of three civilians and one BSF personnel, Minister said. He also informed that the Centre proposes to have a provision for giving INR 5 lakh compensation, in addition to what the state Government pays, to the families of those who get killed in firing from across the border. 22 people were injured while 7,110 people were temporarily affected and 50 houses were damaged, he said.
59259	2011	12	india	Meghalaya Home Minister HDR Lyngdoh on December 14 said, “I have told the Police Headquarter to initially submit a proposal for formation of bomb squad at Jaintia Hills and Garo Hills”. Lyngdoh further said that the State Government would want bomb squads in place in all the seven District headquarters of the State. Further, he informed that in the mean time the Government would continuously send its Police personnel for training to build the manpower required for the bomb squads in the State.
8525	2015	7	pakistan	Two criminals, identified as Majeed Lashari and Paryal, were killed in a Police encounter were seriously in New Karachi Industrial area of New Karachi Town in Karachi, the provincial capital of Sindh on July 1, reports Daily Times. Police said that two pistols with live rounds and stolen vehicle were recovered from their possession.
15076	2014	7	india	The Shillong Times reports that unidentified miscreants abducted two persons from Shillong city, (East Khasi Hills District) according to a complaint lodged on July 7. One Muhammad Akram of 59 Cantonment Board, Lower Paltan Bazar, Shillong lodged a complaint at Lumdiengjri Police Station stating that his son Muhammad Aman Akram and his staff Muhammad Mamrus Ali had gone missing since July 5 around 1 pm. On the same day around 6.56 pm, he received a phone call from an unknown person, claiming that both the persons were under his captivity.
24825	2013	1	india	Kanglaonline reports that amidst the stepped up security measures ahead of the Republic Day celebration, an Improvised Explosive Devices (IED) put inside a school bag was detected at a bushy spot along Imphal Churachandpur highway between Naransena and Sunu siphai. A source informed that the IED was detected by a patrol party of 5 9 Gorkha Rifles at about 6 am on January 23. Explosive experts of Manipur Police, on receiving information about the IED, rushed to the site and set diffused it safely.
1901	2015	3	india	Sanasam Ranjit Singh, who was abducted on February 26 from Chawangkining village in Senapati District, was released on March 3, reports The Sangai Express. Kuki National Front (KNF) and Sadar Hills based Kuki civil bodies had strongly condemned the abduction earlier. In a statement issued by the ‘information and publicity secretary’ of KNF, LH Stephen, KNF held the smaller splinter groups responsible for all abductions and extortions.
20474	2014	6	pakistan	Meanwhile, the Foreign Office (FO) spokesperson Tasnim Aslam on June 12 did not confirm the pre dawn strikes in North Waziristan as drone attacks, but said that Pakistan’s position on drones is clear, reports Daily Times. During a briefing of the Foreign Office, she said that the facts surrounding the attack are being determined. “The nature of the attacks is being ascertained,” she said, without clarifying whether the strike was carried out by a US drone or Pakistani military machinery. “Pakistan’s position on drone attacks is clear.”
34821	2013	10	pakistan	Awais Sheikh, the counsel for Indian prisoner Sarabjit Singh who was murdered in Lahore s Kot Lakhpat jail in May 2013, has taken permanent refuge in Sweden, Times of India reported on October 3. Sheikh took refuge in the Scandinavian country following his alleged abduction bid near Lahore a day before Singh’s death. Singh, who was sentenced to death 16 years ago on espionage charges, died at Lahore’s Jinnah hospital after lying in a comatose state for five days following an assault on him in Kot Lakhpat jail. Sheikh and his son Shahrukh were allegedly abducted from their Bedian Road farm on May 16 and were released three and half hours later. Sheikh was known for fighting cases of Indian prisoners in Pakistani jails and had also written a book on the life of Singh titled ‘Mistaken Identity’. Speaking to the Times of India over telephone from Sweden on September 30, Sheikh said Sweden has granted me permanent stay along with my family and has also provided me all facilities and security after taking note of my abduction and physical torture. The lawyer claimed that his life was under constant threat in Pakistan from people and organisations “inimical to India Pak friendship”.
8425	2015	6	pakistan	At least four Policemen, including Assistant Sub Inspector (ASI) Mohammad Wazir, were killed when unidentified assailants opened fire on the Police patrolling van at Manan Chowk of Pashtoonabad area in provincial capital Quetta on June 11, reported Daily Times. The three other victims were identified as constable Zahir Khan, constable Mehmood Khan and driver Kalimullah. Senior Superintendent of Police Operations (SSP O) Atizaz Goraya confirmed the incident. Capital City Police Officer (CCPO) Abdul Razzaq Cheema said, “Around four attackers were riding two motorcycles... they attacked the Police van.” He added that two attacks on Police vans have been carried out in the same area within a week and with the same modus operandi.
49129	2012	8	pakistan	Law enforcement personnel arrested a suspect and also recovered 60 kilogrammes of explosive material and a remote control that was to be used for detonating the explosive device from a house in Dera Bugti District on August 5, reports Daily Times
53985	2011	2	india	PTI reports that three persons, including a woman, were killed in an explosion at Manatuin Palamu District on February 11. The explosion took place at Sarguja village when the victims were producing landmine and can bombs in the house of Birju Turi, an alleged sympathiser of the Communist Party of India Maoist (CPI Maoist), Deputy Superintendent of Police Surdarshan Mandal said. The three persons, including Birju s wife, were killed on the spot, he said, adding that the identity of the two victims was yet to be established. He said the roof and walls of the house were blown up by the impact of the blast.
59434	2011	12	india	The Odisha Police recovered a huge cache of arms and ammunition from a forest in Koraput District on December 23, reports Zee News. According to reports, the Police recovered landmines, tiffin bombs, one tonne of gunpowder and approximately 50 litres of liquid explosives and forty walky talkies belonging to the Communist Party of India Maoist (CPI Maoist).
28044	2013	7	india	Army foiled a major infiltration bid and killed five militants on the Line of Control (LoC) in the Keran sector of Kupwara District in the night of July 9, reports Daily Excelsior. General Officer Commanding (GOC) of Kupwara based 28 Division of the Army, Major General Lalit Pandey told that eight to nine militants were moving in the forest area about 500 meters inside Indian territory near the LoC. He said that the militants were immediately engaged by firing from the post located along the fence and it resulted in the elimination of five militants, while the remaining flew towards the LoC under the cover of thick foliage. He said that the group of militants belong to Lashkar e Toiba (LeT) and Hizb ul Mujahideen (HM) and had crossed the LoC during the day and were intending to cross the fence under the cover of darkness. The GOC said that there are 350 militants waiting on the launching pads on the other side of the LoC in Tangdhar, Keran, Macchil and Gurez sectors. He said that troops on the LoC are alert to foil any infiltration attempt.
3788	2015	6	india	The intelligence agencies have noted with concern the commemoration of 31st anniversary of Operation Blue Star by hardline Sikh elements across UK, France, US, Germany, Pakistan and Malaysia, in the first week of June, The Times of India reports on June 16. The Union Ministry of Home Affairs (UMHA) which has got inputs regarding the demonstrations and marches organised by groups that are either remnants of Sikh militant outfits like Babbar Khalsa International (BKI) or harbour pro militancy views, is worried that such outfits may have been encouraged by allegedly sympathetic stance of the Shiromani Akali Dal government in Punjab towards militant leaders. The activities reported by agencies from across the world, coinciding with the anniversary of Operation Blue Star in the first week of June, included an event organized by the Gurudwara Committee of Bobigny in Paris (France) on June 7, in coordination with the International Sikh Youth Federation (ISYF). It saw the participants extending their support to Surat Singh Khalsa, who is on a fast in Ludhiana to demand release of incarcerated Sikh militants who have completed their jail terms. Commemoration of Operation Blue Star in Germany, organised with support from Babbar Khalsa elements, was attended by 100 110 people. Around 8 10 of them were reported to be of Pakistan Pakistan occupied Kashmir (PoK) origin. The event, which had Kashmiri hardliners extending support to Sikh extremism, militancy, had better attendance than the 40 persons who were part of the 30th anniversary last year. In Malaysia, around 60 75 people were part of an event organized a Sahib Hulu Kelang Ampang gurudwara in Selangur. Pakistan, which has its own Pakistan Shiromani Gurudwara Prabandhak Committee saw a sit in demonstration at Nankana Sahib and submission of a memorandum to Punjab minister for minorities Tahir Khalil Sandhu. In UK, the Federal Sikh Organisation took out a remembrance march at Ghallughra. Another 3,000 people were part of an event in Hyde Park. A march to Waterloo Place was organized to express solidarity with Surat Singh Khalsa. In the US, a demonstration was organized by around 60 70 people outside the Indian consulate in San Francisco. Punit Khalsa Kaur, a young girl, is said to have made a pro militancy speech. The agencies noted that this was not the first time such a speech was made by her. Around 6,000 8,000 people are said to have participated in Operation Blue Star commemoration events in California.
54389	2011	3	india	According to India Express, Security Forces (SFs) during October 2008 operations in Jammu and Kashmir found that four Lashkar e Toiba (LeT) militants killed in a series of encounters were from Kerala. Subsequently, they learnt that the group had a fifth member, who managed to escape. The revelation set the Police and later the National Investigation Agency (NIA) on a trail that showed how the LeT was recruiting youths from Kerala, training them in Kerala and in Hyderabad of Andhra Pradesh, and then using them for operations in Jammu and Kashmir. Three years on, the NIA has retraced much of the trail with information from two suspected LeT militants from Jammu and Kashmir. Unnamed except as A and B, they have disclosed the identity of the LeT leader who allegedly supervised the recruitment. A and B are mentioned as witnesses in the NIA charge sheet submitted recently in a Special Court in Kochi in Kerala. They were examined under Section 164 of the Criminal Procedure Code (Cr. PC). According to the charge sheet, they have named Wali alias Rashid Abdullah, Baitullah Mujahideen of LeT training camp in Muzaffarabad of Pakistan occupied Kashmir (PoK), as having supervised the recruitments. A and B claim to have attended a jihadi (Holy War) training camp with Wali and the Kerala youths at Lolab forest in Kupwara District.
27413	2013	6	india	A Lashkar e Toiba (LeT) ‘district commander’ for Shopian District, identified as Ashiq Hussain Lone, was shot dead in an encounter after he attacked a patrol party of Special Operations Group (SOG) of Police at village Nellora in Litter area of Pulwama District on June 10, reports Daily Excelsior. Two Police personnel sustained injuries when the militants opened fire. Another militant is reportedly trapped inside the cordon. One AK 47 rifle was recovered from his possession.
23750	2013	6	bangladesh	A Dhaka court on June 20 sentenced 10 militants of Jama’atul Mujahideen Bangladesh (JMB) to death over a suicide bomb attack in Gazipur Bar Association office of Gazipur District on November 29, 2005 that killed eight people including four lawyers and injured eighty others, reports The Daily Star. The convicts are Anayet Ullah, Arifur Rahman, Moshidul Islam, Saidur Munshi, Abdullah Al Sohaien, Nizamuddin Reza, Taibur Rahman, Ashraful Islam, Md Shafiullah and Adnan Sami.
13137	2014	3	india	Two Border Security Force (BSF) personnel were injured when an improvised explosive device (IED), planted by the Communist Party of India Maoist (CPI Maoist) in Malkangiri District of Odisha, exploded on March 28, reports The Hindu. Speaking to The Hindu, Malkangiri Superintendent of Police (SP), Akhileswar Singh, said the blast occurred in a remote jungle area between MV126 and Telarai villages under Kalimela Police Station limits at around 9.30 a.m. Around 40 BSF personnel were involved in an anti Maoist operation in the area ahead of the elections. The injured assistant sub inspector and a trooper were immediately shifted to Malkangiri District hospital. As their condition was serious they were airlifted to Visakhapatnam. According to the SP, the IED was kept concealed in a bush. It exploded when one of the BSF personnel stepped on it. The Maoists had put up posters and banners in the area giving a call for poll boycott. The posters and banners were later removed by security personnel.
63050	2011	11	pakistan	Inter Services Intelligence (ISI) was behind the Mumbai attacks (November 26, 2008, also known as 26 11) as well as the July 7, 2008 bombing of the Indian Embassy in Kabul, reported Indian Express quoting a November 4 British Broadcasting Corporation (BBC) report. In a new two part series titled Secret Pakistan , Bruce Riedel, the Central Intelligence Agency (CIA) officer who served as advisor to United States (US) President Barack Obama, said he had informed the then President elect about 26 11 Everything pointed back to Pakistan. It was a defining moment.” I told the President Pakistan was double dealing us and that the Pakistanis had been double dealing the US and its allies for years and years, and they were probably going to continue to do so, he said. Riedel pointed out that this (the attacks) had the signature of Lashkar e Toiba (LeT) all over it, from the very moment the attacks began. And once you link it back to LeT, you link it back to the Pakistani Intelligence service, the ISI. The second part of the programme, revealed the CIA later received intelligence that said the ISI were directly involved in training the Mumbai gunmen . About the car laden explosives that went off at the Indian Embassy in Kabul, Mike Waltz, who worked in the US Vice President s office while George Bush was the President, said Through information and a series of events (not to mention preceding intelligence intercepts) it became pretty clear the Pakistanis were behind the Jalaluddin Haqqani Network, which was behind the bombing.
9608	2015	12	pakistan	An Afghan Taliban militant was killed while a Policeman was injured during a Police encounter in Safdarabad area of Sheikhupura District on December 13, reports Daily Times. During the encounter three of his aides managed to flee. A suicide jacket, two hand grenades and a huge cache of arms were recovered from his possession.
28677	2013	8	india	The Central Government has held the State Police Forces responsible for attacks on Security Forces (SFs) and politicians in Naxal Left Wing Extremism (LWE) affected areas, reports The Times of India on August 8. It has blamed their lack of preparedness and failure to stick to Standard Operating Procedures (SoPs) for casualties on the side of the State. This is probably the first time that the Union Government has openly criticized State Governments for failure to prevent LWE attacks. Minister of State for Home Affairs R P N Singh said in Lok Sabha (Lower House of Indian Parliament) on August 7, An analysis of recent Naxal attacks discloses that the attacks could succeed mainly due to failure of adherence to basic Policing tactics and practices by some of the State Police Forces. He went on to stress that attacks could have been anticipated and measures taken to prevent them but States failed to do so. Till July 15, 2013 the country has witnessed 630 incidents of LWE violence that have claimed the lives 149 civilians, 68 SFs and 59 LWEs.
61961	2011	8	pakistan	A US drone strike targeting a vehicle near Qutab Khel village, five kilometres east of Miranshah, the main town in North Waziristan Agency of Federally Administered Tribal Areas (FATA) killed four militants on August 2.
43331	2012	9	india	Police have identified the suspected Maoist, who was killed in an exchange of fire in Cheru Forest in the Dakshina Kannada Hassan Border on September 4, as Yellappa alias Dinakar, an area committee member of the CPI Maoist. Anti Naxal Force Commander Alok Kumar said Yellappa, a native of Raichur, had been associated with the Maoist organisation since 2004. Mr. Kumar said materials recovered from the place of encounter showed Yellappa had knowledge of making improved explosive devices. He might have come to the region in a capacity of trainer, he said.
64075	2011	5	nepal	The Unified Communist Party of Nepal Maoist (UCPN M) has decided to submit a “more acceptable proposal” for their Army integration that would incorporate the suggestions forwarded by Nepal Army, reports Kantipuronline. “We will soon come up with a next alternative. We are inclined to accept the modality suggested by Nepal Army with some changes,” said an unnamed Maoist leader, adding, that the upcoming standing committee of the party would finalise a proposal. Earlier, saying the issues of integration and rehabilitation of former Maoist combatants should be addressed politically, the UCPN M, in its proposal sent to the government and the main opposition Nepali Congress (NC), has sought simultaneous development of national security policy, and restructuring plus esoteric “democratisation” of the security bodies along with the task of integration, adds Himalayan Times. In the eight point proposal, the Maoists stressed on founding a separate structure for their People’s Liberation Army (PLA). “But taking into account the concerns of all sides a unified new force can also be formed,” it said, pointing out border security and natural disaster management as the dominion of the force to be set up with a PLA dominance. The proposal has envisioned the PLA leadership of the force that will be formed by incorporating 10,000 former fighters and the same number of personnel combinedly from the existing three forces— Nepal Army, Nepal Police and Armed Police Force. For rehabilitation, the proposal has talked about providing a fat purse to the combatants if they choose not to be the part of army integration but prefer joining politics or social sector NR 7 lakh up to the post of ‘platoon commander’ and NR10 lakh above it under the scheme of “golden handshake.” The handicapped and injured PLA men will also be entitled to the scheme. The government is yet to decide on the proposal, while the Nepali Congress has snubbed it saying the maximum number of PLA combatants should be 5,000.
63069	2011	11	pakistan	The wife of pro government tribal elder Malak Mohammad Omar was killed and he himself, his father and a son were injured when about 25 militants stormed his house in Bara Kaman Gara area of Nawagai tehsil (revenue unit) of Bajaur Agency in the night of November 5. Political Tehsildar Shah Naseem Khan told reporters that one of the attackers was killed and several others injured when Security Forces and tribal volunteers fired back.
