index	year	month	location	news
57735	2011	9	india	General Officer Commanding (GOC, 16 Corps) Lieutenant General J. P. Nehra on September 19 said that infiltration attempts have increased during the past few months, reports Daily Excelsior. He said, During the past one and half months, infiltration attempts have been increasing in the area of White Knight Corps but each and every attempt was foiled by the alert and vigilant troops.” No, there was no attack by Pakistani troops on Indian forward post to capture it along the Line of Control LoC . There was only an incident of firing and the same was repulsed effectively , he said in response to a question, adding due to retaliation by our troops, they (Pakistani troops) suffered damages . In response to another question, he said, Winter or summer doesn t make much difference as far as White Knights area of responsibility is concerned. In some areas, militants do change their tactics during winter but we have our strategy in place and Army with the assistance of Police and local administration would continue to foil their nefarious designs. Regarding number of terror camps, militants in Pakistan and PoK, he said, The terrorist camps were never de activated across the fence but the figure keeps varying. As per the latest inputs from the intelligence agencies, there are about 42 camps opposite the area of responsibility of White Knight Corps and the number of militants may be between 250 to 500. Though there is no specific information regarding fresh recruitment yet continuous attempts are being made, he further said. He also added, Pakistan has become an epicenter of global terrorism and failed to tackle growing extremism on its own soil , he further said, adding while Pakistan is an epicenter of the global terror, it is a key ally of the US on war against terrorism. It is a partner in the war to tackle terror in other countries like Afghanistan but has failed to tackle growing terror on its own soil, he stated.
32567	2013	3	pakistan	A leader of the Sindh Tarqi Pasand (STP), Qambar Shahdadkot District President Abdul Aziz Mastoi, was killed in a firing attack in the limits of City Police Station of Qambar Shahdadkot on March 27, reports The News.
64695	2011	3	srilanka	Government of Sri Lanka on its own must investigate the killing of thousands of civilians in the final months of its separatist war with theLiberation Tigers of Tamil Eelam (LTTE) or else may risk an international probe into the alleged war crimes,said Robert O. Blake, Assistant Secretary, Bureau of South, and Central Asian Affairs of the US State Department said in an interview to the AFP news agency, Colombo Page reported on March 1. While insisting that the United States is not holding Sri Lanka to any special standards, he said that a major issue for the US as well as for the international community is the question of accountability in Sri Lanka s war against the LTTE. As you know, the UN has estimated that many thousands of civilians were killed at the end of, in the final few months of the war. Those need to be investigated, preferably by the Government of Sri Lanka and its own institutions, Blake said during the interview. The Assistant Secretary noting that there are still a number of important steps to be taken said the US would prefer to see Sri Lanka taking its own measures to handle those issues. It s always best for a host nation to take responsibility for these sensitive issues. But I think also it s important to say that if Sri Lanka is not willing to meet international standards regarding these matters that there will be pressure to appoint some sort of international commission to look into these things, he cautioned. He noted that the Government has implemented some of the measures recommended by the country s own investigative body Lessons Learnt and Reconciliation Commission (LLRC) and appointed 350 Tamil speaking police to serve in Jaffna. The LLRC is to submit its report the President Mahinda Rajapakse in May. He, however, stressed that Sri Lanka must achieve national reconciliation he said that the postponed third round of talks with the Tamil National Alliance (TNA) can be rescheduled as soon as possible. Earlier, the third round of the talks scheduled for March 1 between the Sri Lankan Government and TNAwas postponed until after the forthcoming local Government electionson March 17. The TNA was to discuss several issues concerning the Northern and Eastern provinces and the people living in those areas at the talks. The TNA had also extended an invitation to the minor Tamil party People s Liberation Organization of Tamil Eelam (PLOTE) to join the discussions scheduled. Discussions between the TNA and the Government commenced in order to address issues related to the resettlement of people in the North, the troubles faced by Jaffna fishermen and finding a solution to the ethnic issue. The first round of talks between the Government and the TNA was held on January 10 and the second round of talks was held on February 3.
18379	2014	12	india	On December 2, Minister of State for Finance, Jayant Sinha in a written reply in Rajya Sabha (Upper House of Indian Parliament) stated that Government has seized Fake Indian Currency Note (FICN) with a face value of INR 59,83,000 which has linkage to Pakistan in three fiscal years, reports Zee News. Replying to a question whether it was a fact that FICN is being sneaked into the country from Pakistan, Jayant Sinha in a written reply in Rajya Sabha said, Yes Giving details he said FICN with a face value INR 24,93,000 were seized from Munabao village in Barmer District of Rajasthan bordering Pakistan in 2012 13. In 2013 14, FICN with a face value of INR 30.01 lakh were seized from Krishnanagar in Nadia District of West Bengal and Delhi. In 2014 15 (till October), again counterfeits with a face value of INR 4,89,000 have been seized in 2014 15 from Malda District in West Bengal. The Indian banking system detected over 2,52,000 pieces of FICN of INR 500 denomination in Financial Year 2014 as against the 2,81,000 the year before. The number of INR 1,000 denomination fake notes rose to 1,10,000 as against the 98,459 in the preceding year, according to a study by Reserve Bank of India (RBI).
22741	2014	12	nepal	On December 7, the Dailekh District Court in Kathmandu, convicted five persons in the 2004 murder case of journalist Dekendra Thapa, a correspondent for state owned Radio Nepal, who was abducted on June 26, 2004, and later was killed by the then Maoist cadres on August 11, 2004, reports The Himalayan Times. A single bench of District judge Dilli Ratna Shrestha convicted Jaya Bahadur Sahi, Hira Lal Pun, Nirak KC, Bir Bahadur Gharti and Laxmiram Gharti in the Thapa murder case.
62045	2011	8	pakistan	At least five people, including activists of the Muttahida Qaumi Movement (MQM) and Pakistan People’s Party (PPP), were shot dead in separate acts of target killing and violence in different parts of Karachi on August 9, reported Daily Times. An MQM activist, Azeem, was shot dead near Jhanda Chowk in Liaquatabad area within the jurisdiction of the Super Market Police Station.
10125	2015	8	nepal	Four Constituent Assembly (CA) members from the Sadbhavana Party (SP) on August 23 submitted their resignations to CA Chairman Subas Nembang alleging that the major political parties ignored the voice of minorities by taking advantage of their strength in CA, reports Myrepublica.com. Though the party had announced on August 18, to submit resignation of all its six lawmakers, only Laxman Lal Karna, Bimal Kumar Kediya, Shail Kumari Devi and suspended lawmaker Sanjay Kumar Sah submitted their resignations on August 23. According to Karna, lawmaker Madhvi Rani was unwell while Narsingh Chaudhary was outside Kathmandu Valley and the two will also submit their resignations soon. On behalf of Sah, Karna submitted the resignation to the CA chairman since Sah is in jail on the charge of masterminding a bomb attack in Janakpur in 2011. Exiting the CA chairman s chamber after submitting the resignations, Karna said that they were forced to resign as the major parties conspired against the people of Madhes, Tharuhat, indigenous communities and women. We cannot cling on to our CA seat when people are dying on the streets, reiterated Karna. Meanwhile, with the submission of the revised draft constitution at a full House meeting of the CA on August 23, the CA secretariat has stepped up the final work of producing a new constitution through the CA, reports Myrepublica.com. Officials said that as per the latest plan, the secretariat is working under a timeline to conclude all the remaining procedures and promulgate the new constitution by mid September. The full CA on August 23, decided to allow three days for lawmakers to study the revised draft. After the study time ends, lawmakers will be allocated five days at the most for general discussions on the revised draft constitution at the full CA meeting.
45369	2012	12	india	With regard to the cases of serial blasts in the courts of Lucknow, Faizabad and Varanasi of November 23, 2007, the Anti Terror Squad (ATS) is saying the blasts were jointly carried out by Harkat ul Jehad e Islam (HuJI) and Indian Mujahideen (IM), Indian Express reports on December 20. ATS has also named seven Azamgarh based alleged IM operatives. The ATS, which is investigating the blast cases, has made the disclosure in a letter attached with the affidavit filed by Varanasi Police before the High Court. The letter gives the status of the cases and the names of the accused which came into light during the investigation.
59665	2011	1	pakistan	Three persons, including a senior government official and a woman, were killed in two separate firing incidents in Quetta, the provincial capital of Balochistan on January 15, reports Daily Times. Pakistan Council of Research in Water Resources (PCRWR) Deputy Director Abdul Qayyum was going to his office when some unidentified men opened fire at his vehicle on the Airport Road near a NADRA office. Qayyum received three bullets and died on the spot. The assailants, however, managed to escape from the scene.
34367	2013	8	pakistan	A labourer, identified as Naseeb Zada, was killed in Qasba Colony in Peerabad area of SITE Town on August 30, reports The News. Peerabad SHO Abdul Moeed said, “Policemen patrolling the area in a van saw the incident and chased the fleeing attackers.” “After a shootout, the Police arrested one of them, identified as Wali Jaan, while the other escaped.”
29963	2013	10	india	Meanwhile, Army Chief General Bikram Singh on October 9 said, For peace to return to this region, which is imperative, the Pakistani army has to be made accountable. They (Pakistani army ISI) must desist from supporting terrorists, who are double edged weapons and could well inflict serious injuries on them , reports The Times of India. we have a lot of information about Pakistani army s support to the 42 terror training camps still operational across the border, a day after he directly blamed the General Pervez Kayani led force for the surge in infiltration bids and ceasefire violations along the Line of Control (LoC) this year. For long, everybody has been talking about peace and normalcy returning to J K, with various parameters being quoted. This (the surge) is an attempt by the Pakistani army ISI to vitiate the environment in the Kashmir Valley, added Gen Singh. The number of ceasefire violations has already crossed over 165 this year, the highest recorded over the last decade. As many as 105 of them have taken place just since August, barely a couple of months after Sharif took over as the PM, leading many to observe the Pakistani army Inter Services Intelligence (ISI) combine is reasserting its pivotal role on the Kashmir front. Gen Singh said India will have to wait and watch how the situation unfolds in Afghanistan after next year s drawdown of US led coalition forces from there. We will have to be vigilant about any fallout that may be detrimental to us, he said.
61642	2011	7	pakistan	At least four persons were killed and nine others injured in a blast in Chaman town of Qilla Abdullah District on July 14 (today), reports Dawn. The cause of the blast has yet to be determined.
124	2015	2	bangladesh	Police arrested 16 cadres of Islami Chhatra Shibir (ICS), the student wing of Jamaat e Islami (JeI), along with explosives, bomb making materials in Rajshahi and Feni Districts on February 1, reports The Daily Star. In Feni District, Police arrested 12 cadres of ICS after raiding two houses in Feni town. In Rajshahi District, acting on a tip off Police raided a house at Rajshahi city s Bhatapara and arrested four cadres of ICS s bomb manufacturing unit. Police recovered 10 crude bombs, bomb making materials from the house
29888	2013	10	india	On October 6 Lashkar e Toiba (LeT) operative Abdul Karim Tunda was on brought to Hyderabad (Andhra Pradesh) from Delhi by Hyderabad Police in connection with a case lodged against him here in 1998 on charges of waging war against India, reports dnaindia.com. Tunda will be produced before a local court today and we will seek his 15 day police custody to interrogate him in connection with the case lodged against him, Deputy Commissioner of Police (Detective Department) LKV Ranga Rao said. The Hyderabad Police, in its plea, had said that a case was lodged on July 2, 1998, on a complaint that ISI activities are going on in order to wage war against the government and to create unrest in India and to cause damage to internal security of India and to Hindus and their properties on a large scale.
1815	2015	2	india	Prime Minister (PM) Narendra Modi on February 27 said that his government has only one religion India first and all communities need to unite to fight against terror, reports New Kerala. The country can run only within the constitution and law. No one can take law in their hands and discriminate on the grounds of religion, Prime Minister Modi said. We believe in Unity. All communities need to unite to fight against terror, he added. Prime Minister Modi, who was replying to the debate on President Pranab Mukherjee s address in the Lok Sabha, also drew the attention of the parliamentarians to the bomb explosions that rocked Patna s Gandhi Maidan hours before his Hunkar rally in 2013. When I was in Patna in 2013, the bomb blasts took place. I had asked then, who does a Hindu have to fight with, Muslims or poverty . Both need to unite to fight against terror, he said.
5554	2015	9	india	According to latest Union Ministry of Home Affairs (UMHA) figures, kidnappings, a staple insurgent activity in the North East, has seen a significant decline this year, with the worst affected state of Assam showing a nearly 70 per cent drop in kidnapping incidents even as the recently banned Khaplang faction of National Socialist Council of Nagaland (NSCN K) outfit resorted to maximum abductions for any outfit in 2015, reports The Economic Times on September 22. The figures show that 182 kidnappings have been reported this year from the seven northeastern states compared to 250 in the same period last year and 369 in all in 2014. Assam has seen the biggest drop from 125 in 2013 and 94 in 2014 to only 24 so far this year, kidnappings in Meghalaya are down from 110 last year to 45 so far this year and the same is down to 24 in Arunachal Pradesh from 49 last year. The maximum kidnappings by any outfit in the North East this year, 34, have been done by the just banned NSCN K outfit in Nagaland and Arunachal Pradesh, followed by 24 by Khole Khitovi faction of NSCN (NSCN KK) in both these states and 15 by the Isak Muivah faction of NSCN (NSCN IM) with which a framework agreement was signed recently. In fact, Nagaland has now overtaken Assam as the state worst affected by kidnappings, reporting 55 cases already compared to 65 in all in 2014. The Naga outfits in Manipur along with NSCN K have meanwhile emerged as the most violent North East outfits this year, resorting to 65 incidents of terrorism and inflicting 27 casualties on Security Forces (SFs) this year through ambush attacks in Manipur and Nagaland on convoys of Army and Assam Rifles (AR) the total casualties of SFs this year have hence jumped almost 300 per cent to 40 from only 12 in 2014. Civilian casualties are however down to a record low at only 32 casualties this year compared to 114 in the same period last year. Tripura, where the State Government lifted Armed Forces Special Powers Acts (AFSPA) earlier this year, continues to be the most peaceful state in the North East, reporting only one violent incident, a single civilian death and two killings of SFs. Manipur, the worst affected state by insurgency in North East, has seen an improvement, with violent incidents down by nearly 25 per cent.
6210	2015	11	india	General Officer Commanding (GOC) of Srinagar based 15 Corps, Lieutenant General S K Dua, on November 3, said that there was increased pressure on militants to infiltrate before the winter, reports Daily Excelsior. “There is increased pressure on them (the militants) to infiltrate before the winter. Sometimes they just cross the Line of Control (LoC), open fire and then go back,” Lt General Dua told reporters on the sidelines of a function in Srinagar. The GOC said the infiltration from across the LoC was “next to nil” this year so far and the anti infiltration grid was fully prepared to keep it that way. Lt General Dua said the ceasefire violation at LoC in Gurez sector of North Kashmir Bandipora District on November 2, which left two soldiers dead, was part of an effort to push militants into Kashmir. “It (ceasefire violation) seems to be an attempt to infiltrate more terrorists before the snowfall along the LoC,” the GOC said. Asked about the ceasefire violation in Gurez as it was not a traditional infiltration route, Lt General Dua said “They might have changed the tactics. The grid is coordinated and we are ready to take on the challenge.” The GOC said that militants are making desperate attempts to infiltrate and robust counter infiltration is foiling their attempts. “There has been no let up in the intent (to infiltrate) but the robust anti infiltration grid has ensured that the attempts are foiled,” he said. Lt Gen Dua said, intelligence inputs suggest that over 300 militants are at various launch pads across the LoC waiting for an opportunity to infiltrate.
34154	2013	8	pakistan	A Deputy Superintendent of Police (DSP), Qasim Ghauri, and an Assistant Sub Inspector (ASI) of Police, Aslam, were killed while the Station House Officer (SHO) Haider Zaidi and two other constables were injured on August 15 during a six hour long operation to arrest a gang of extortionists in the Gulshan Town of Karachi District, the provincial capital of Sindh, reports The Express Tribune. The operation was carried out against gangster Zamin Shah Chandio, who was hiding in the settlements of Hussain Hazara Goth and Madho Goth near Safari Park in the Gulistan e Jauhar area of the Town. In retaliation the Police killed Zamin Chandio, along with his three accomplices Ilahi Bux Chachar, Ardillo and Sunbul Ahmed. According to Police details, Chandio had refused to pay bribe to the Gulistan e Jauhar Police Station and allegedly assaulted its Police Constable, Waseem. When the injured constable returned, the Police team went to raid the gangster’s hideout. However, the gangsters opened fire at the Police team killing Police officers. In retaliatory firing the gangster along with his accomplices was shot dead. Deputy Inspector General (DIG) Tahir Naveed, who was supervising the entire operation, criticised the Policemen occupying lower ranks in the Department. “Some black sheep of the Police Department were involved in giving permission to some criminals to run their illegal activities in the area,” he pointed out, adding that these Policemen had allowed gambling dens, land grabbing and extortions to take place under their patronage. “These same elements were involved in the Police encounter.” However, the leader of Jeay Sindh Tehreek (JST), an offshoot of Jeay Sindh Qaumi Mahaz (JSQM), Habib Jatoi admitted that the deceased were their party activists and the Police shot them dead in a fake encounter. When the Police reached the area, the activists surrendered themselves, he claimed. “Basically, it was an extra judicial killing.”
21692	2014	11	pakistan	Police on November 14 killed five Tehreek e Taliban Pakistan (TTP) militants in an encounter in Gulshan e Buner area of Landhi Town in Karachi, the provincial capital of Sindh, reported Dawn. Senior Police official Rao Anwar said, “Police asked the militants to surrender, but they opened fire, after which police responded,” he added. “Five terrorists were killed in the exchange of fire,” Anwar said, adding that a large stash of weapons was recovered from the scene.
37590	2012	11	bangladesh	Islami Chhatra Shibir (ICS) cadres on November 23 hurled a bomb and brickbats on Police in Jessore town of Jessore District while the Police besieged a student s mess allegedly controlled by the ICS, reports The Daily Star. In return, Police fired two blank shots and arrested 12 ICS cadres from the mess who gathered there to plot subversive activities.
24073	2013	10	bangladesh	In Sathikra District, a JeI cadre identified as Shafiqul Islam was killed at Shyamnagar sub District in violence when AL activists had attacked a JeI procession in the area. He died after being hit with a stone the AL activists had hurled. He died on the spot.
1543	2015	2	india	A 35 year old man, identified K. Benny, was found killed of bullet injuries around midnight on February 12 in a forest area close to the Bhavani river at Chindakki near Attappady in Palakkad District, reports The Hindu. Police said K Benny was shot by unidentified assailants. The incident took place when Benny along with his friend Sheli was fishing in the river. Though the Police suspect it to be a case of Communist Party of India Maoist (CPI Maoist) attack the local people want a probe into the presence of the two youth at the isolated location late night.
35884	2013	12	pakistan	Bomb Disposal Squad (BDS) personnel defused a bomb, weighing eight kilograms, on Saeed Ahmed Khan Road in Quetta on December 25, reported Dawn. Police sources said that two mortar bombs were found, wired up together and connected to a detonator, in a trash bin located on Saeed Ahmed Khan Road in central Quetta. Area residents had informed the security personnel of the presence of explosives after which the BDS was called in. The disposal squad personnel reached the site and defused the bomb. BDS officials later said that the eight kilogram bomb would have caused a great amount of damage had it detonated.
60624	2011	5	pakistan	Twenty five foreign militants, including Pakistanis, were killed and wounded by Afghan Security Forces (SFs) after they crossed the border from Pakistan, reported Daily Times. Jamaluddin Badr, Governor of north eastern Nuristan province, said the 25 foreign militants which included Arabs, Chechens and Pakistanis were killed and wounded overnight. He said the operation was launched to guard against attacks after Osama bin Laden’s death on May 1. “We are aware of the situation here now that al Qaeda and other elements will try to infiltrate into Afghanistan. We have launched an operation to control border infiltration,” said Badr.
27933	2013	7	india	in Latehar District, in West Jharkhand along the border with Chhattisgarh, over 1,200 Policemen and Centrally Armed Police Forces (CAPFs) were deployed to surround areas of the Kumandih forest in Manika block, where over 200 cadres of CPI Maoists are believed to have come together for a meeting. Continuing the operations for the 10th day in the area, State Police and CAPFs, including Commando Battalion for Resolute Action (CoBRA), destroyed some camps on July 3 and July 4 and seized three Improvised Explosive Devices (IEDs), 13 detonators, several backpacks, mobile chargers and literature from a camp near Murhar hills in Kumandih. Jharkhand Director General of Police (DGP) Rajiv Kumar who visited the area on July 3 said, “We have information that several top leaders of the Koel Sankh zone were having meetings in the area. We are proceeding cautiously as Maoists had planted explosives in the entire area. In some parts of the thick forest, they have occupied hilly terrain, where they will be an advantage.” Further, in an interview with Pioneer, the DGP said the Security Forces (SFs) will fight the Maoists to the finish in Kumandih jungle, spreading over 50 60 square kilometres. They should either surrender or face the bullets. They can t escape as we have deployed troops at all the possible exit points, he added. The DGP said five companies of forces drawn from Jharkhand Armed Police and Indian Reserve Battalions were deployed on July 4 to the existing strength of 1,500 troops fighting the Maoists since June 24. Though the Maoists presence in Santhal Pargana has been there for the last five years, but my assessment is that they don t have formidable strength. That Balihar could speak to the office in charge of Amarapara after the ambush shows that they were not in huge numbers during the incident near Kathikund, he added.
7484	2015	2	pakistan	Unidentified militants blew up a railway track in the Bakhtiarabad area of Sibi District on February 7, reports Dawn. Levies sources said that a two feet track was damaged when an Improvised Explosive Device (IED) was detonated, suspending train services between Balochistan and other parts of the country.
