index	year	month	location	news
62852	2011	10	pakistan	Islamabad on October 17 said that Afghan and US led forces had failed to hunt down Maulvi Fazlulla, a Tehreek e Taliban Pakistan (TTP) cleric responsible for a spate of cross border raids despite repeated requests from Islamabad, reports Daily Times. Pakistani officials have urged the US to focus on defeating its enemies in Afghanistan instead of blaming Islamabad for its failures. “We have given locations and information about these groups to the Afghanistan Government and ISAF International Security Assistance Force , but there has been no action,” Inter Services Public Relations (ISPR) Director General, Major General Athar Abbas said. Fazlullah was the TTP leader in Swat Valley of Khyber Pakhtunkhwa province, about 160 kilometers northwest of Islamabad before a 2009 army offensive forced him to flee. Also known as FM Mullah for his fiery radio broadcasts, he regrouped in Afghanistan and established strongholds, and poses a threat to Pakistan once again, said Abbas. Fazlullah, a leading figure in the TTP is based in Kunar and Nuristan provinces of Afghanistan, said Abbas. “When they ran away from Swat, Fazlullah’s group was in tatters and was scattered,” Abbas said, adding, “They got time and support in Afghanistan.” However, Mansur Khan Mehsud of Islamabad’s FATA Research Centre doubts Fazlullah could take control of Swat or other areas. “While Fazlullah has the support of Afghan Taliban in the Kunar and Nuristan provinces, he has the capacity to only launch hit and run attacks,” Mehsud said.
59840	2011	2	pakistan	Militants on February 5 ambushed a car of the family of a Federal Government official, Zeenat Shah, on Kohat Hangu highway and injured three persons, reports Dawn.
61018	2011	6	pakistan	Crime Investigation Department (CID) of Sindh Police claimed to have arrested a suspected Tehreek e Taliban Pakistan (TTP) militant, Khan Afsar Mohmand alias Jawad, from Manghopir area of Karachi, reports Express Tribune. He is involved in numerous target killings, kidnapping for ransom and extortion cases. A TT pistol and ammunition was allegedly seized from him and a hit list containing the names of senior leaders of Political parties and Police officers was also found on him. Afsar is believed to have joined the TTP in Mohmand Agency of Federally Administered Tribal Areas (FATA) where he conducted militant operations against the Armed Forces. He is said to be closely linked with TTP’s Qari Shakeel group based in the northern areas and is charged of killing seven people in 2010 and one person named Farooq Ahmed in January 2011. Moreover, he carried out most of the murders within the jurisdiction of Pirabad, Mominabad and Site A. It was reported that there are more than a dozen active members of Afsar’s TTP cell in Karachi, who remain at large. The preliminary interrogation revealed that the suspect along with other TTP members was planning a huge suicide bombing mission in Karachi.
26040	2013	3	india	Union Government has launched online Terrorist Information System (TIS) to aggregate states terrorist data under a single platform to help agencies coordinate better. A senior MHA official said, States are expected to upload all details within a fortnight so that each one of them can get details of any terror incident in the country with just a click of mouse or touch of mobile screen after logging onto the TIS website.
11057	2014	1	bangladesh	In Thakurgaon District, three BNP men were killed as law enforcers opened fire on the BNP and JeI cadres who tried to bar voters from casting their votes at a polling centre in Sadar sub District. The deceased were identified as Joynal (21), Harun (20) and Abu Hanif (28). At least 50 others were injured during the attacks.
10800	2015	8	srilanka	Jathika Hela Urumaya (JHU) leader Champika Ranawaka said that the Government of former President Mahinda Rajapaksa had allegedly given the Liberation Tigers of Tamil Eelam (LTTE) over LKR 169 million to win their support at the 2005 Presidential election, reports Colombo Gazette on August 11. Ranawaka said that he has all the evidence, including documents, to back the allegations. Ranawaka revealed the names of LTTE members who a businessman had met on behalf of Rajapaksa to seal the deals in the guise of tsunami relief. Ranawaka claimed that during discussions Basil Rajapaksa had with one LTTE negotiator identified as Emil Kanthan at the businessman’s office, Basil Rajapaksa had told Emil Kanthan that “What Prime Minister Mahinda Rajapaksa wants is a boycott of voting in the North, and the PM wants to know what the LTTE would like to have in return.” In reply at a later date Emil Kanthan had said that the LTTE wants to purchase some boats and requested for a sum of LKR 180 million from Basil Rajapakse. Ranawaka claimed that Basil Rajapakse agreed immediately to provide the said amount of money and on a later day Basil Rajapaksa came with a number of large travelling bags to meet Emil Kanthan at the businessman’s office to seal the deal.
35221	2013	10	pakistan	The Government on October 30 claimed that more than two thousand suspected terrorists have been killed in 317 drone strikes in the past five years while only 67 innocent civilians have died in these attacks, reports Dawn. The Ministry of Defence furnished a written reply in the Senate detailing the number of US drone strikes in the past five years. Surprisingly the Ministry of Defence data also claims that no innocent civilian was struck by the drone strikes since January 2012 while more than three hundred terrorists were targeted in the strikes. The official data negates the claims by local political and religious parties that US drone strikes in Pakistan have mostly killed innocent civilians, including women and children. According to the official data, this year has witnessed the lowest number of drone strikes which are 14 as compared to 2010 when the US hit Pakistan’s Federally Administered Tribal Areas (FATA) 115 times through drone attacks. Only three percent of 2,227 people killed in US drone strikes since 2008 were civilians, a surprisingly low figure that sparked criticism from groups that have investigated deaths from the attacks. The number is much lower than past Government calculations and estimates by independent organizations that have gone as high as 300. The Ministry said 317 drone strikes have killed 2,160 Islamic militants and 67 civilians since 2008. However, the Foreign Office said on October 31 that the Government was convinced that drone attacks were counter productive and it (FO) had sought details from the Ministry of Defence about the low non combatant casualty figure reported in Senate. “Our position on the drone strikes is very clear. We are convinced that drone strikes are counter productive,” Foreign Office spokesman Aizaz Chaudhry said at the weekly media briefing.
30932	2013	11	india	Two civilians, including a woman, were shot dead in cold blood by the Communist Party of India Maoist (CPI Maoist) cadres in cut off area of Balimela reservoir in Malkangiri District on November 29, reports The Hindu. Their bodies were located in the jungle near Bailiguma village under Paparmetla Police Station limits. The victims were identified as Sathi Rao Hantal and Laxmi Khora. Both of them were residents Bailiguma. This was the first time Maoists killed a woman in Malkangiri District. Speaking to The Hindu over phone, Sub Divisional Police Officer Shiva Subramaniam said it was yet to be ascertained why Maoists had killed the civilians. Both were from poor families and they were in no way related to any organisation or public activity.
26132	2013	4	india	Kanglaonline reports that David Luvson, ‘public relation officer (PRO)’ of the National Socialist Council of Nagalim Khaplang (NSCN K) was shot dead by suspected cadres of the National Socialist Council of Nagalim Isak Muivah (NSCN IM) at Aziuram road, which is 3 kilometers away from the old Tamenglong under Tamenglong District on April 1 at around 10.30am. According to sources, the ‘PRO’ was shot while he was going in a gypsy toward Aziuram road. David was under ‘suspension’ after he was found involved in a case, adds Nagaland Post.
63134	2011	11	pakistan	Five Frontier Constabulary (FC) personnel were killed and six others injured when militants first attacked a check post and later an FC convoy in Bara tehsil (revenue unit) of Khyber Agency in Federally Administered Tribal Areas (FATA) on November 14, reports Dawn. The FC personnel led by Lieutenant Colonel Azhar Amin had gone to Nala in Malikdin Khel area to shift the body of Latif Khan who was killed when militants had attacked a check post in the morning. As the FC convoy was carrying the body militants ambushed it, killing four personnel, identified as Ibrahim, Majeed, Waseem and Salman. Officials said that Lieutenant Colonel Azhar Amin, Naib Subedar Noor Badshah, Sepoys Zahid Khan, Mashoor Khan and two others were injured.
8963	2015	9	pakistan	A traffic Police Constable was shot dead while two others sustained injuries when unidentified militants opened fire at them in Site B area of SITE Town in Karachi, the provincial capital of Sindh on September 2, reports Dawn. Giving details, Karachi West Senior Superintendent of Police (SSP) Azfar Mahesar said that this was the third attack on traffic police officials in the last one week. He termed it as “a new wave of targeted killing of policemen.”
59417	2011	12	india	A group of 10 Communist Party of India Maoist (CPI Maoist) cadres shot dead Killo Hari (26), a villager of Nimmalagondi, an interior village in Koyyuru mandal (administrative unit) bordering G.K. Veedhi mandal in Visakhapatnam District on December 23, reports The Hindu. The Maoists took away the victim from his house and shot him dead on the village outskirts. They left a pamphlet near the body and pasted posters on a night halt Andhra Pradesh State road Transport Corporation (TAPSRTC) bus which said that the Police were responsible for the deaths of Police informers. Galikonda area committee secretary Krishna is suspected to be behind the killing. Hari was a Maoist sympathiser.
42411	2012	7	india	According to the State Home Department, 5,000 houses were set ablaze in 244 villages during the Bodo Muslim clashes, reports Times of India. The clashes have led to the death of 61 people. Kokrajhar, Chirang, Baksa Districts in Bodoland Territorial Autonomous District Council (BTC) areas and parts of Dhubri and Bongaigaon District were affected. Further, about four lakh violence hit people are presently taking shelters in about 278 relief camps. Eleven people are still reported missing since the start of the violence. The clashes started when founder president of All Bodoland Minority Students’ Union (ABMSU) , Mohibul Islam and former leader of All Assam Minority Students’ Union (AAMSU), Abdul Siddique Sheikh were seriously injured in the attack on July 19. In a retaliatory attack, a mob of people at Joypur under Kokrajhar Police Station lynched to death four former militants of disbanded Bodoland Liberation Tiger (BLT) Pradip Bodo (32), Jonson Bodo (36), Nip Goyari (25) and Jamin Goyari (24) in the night of July 20. Initially, Kokrajhar and then Chirang District were affected. Later, violence also spread to Dhubri and Baksa Districts.
27253	2013	6	india	Meanwhile, a medical doctor from East Garo Hills was recently served with an extortion notice of INR 300000, according to a report of June 2. Sources have revealed that the doctors would be going on strike and threatened not to attend to their duties as a mark of protest against the demand notes coming from GNLA leader Sohan D Shira. Sources informed that recently Sohan Shira also demanded INR 100 million from the road construction company BSC C C (JV). The company has been served with an ultimatum to either pay up or leave. The Hyderabad based company is engaged in road construction project linking West Khasi Hills with Garo Hills.
9725	2015	12	pakistan	A cache of weapons and explosives was recovered during a search operation in Ghulam Khan area of North Waziristan Agency (NWA) on December 31, reports Dawn. According to NWA Political Agent Kamran Afridi, the political administration after getting information about presence of weapons in the area launched a search operation and seized a huge cache of light and heavy weapons, hundreds of cartridges and explosives from the deserted houses in the region.
37106	2013	10	srilanka	Anuradhapura High Court on October 24 sentenced the Liberation Tigers of Tamil Eelam (LTTE) suspect, Mahilingam Muthulingam, also known as Indran, to five years of rigorous imprisonment for his role in the 2006 bomb attack on a bus in Kebithgollewa in North Central Province, reports Colombo Page. The Judge also ordered the Prison Commissioner General to send the convict for one year rehabilitation after he completes the 5 year jail sentence. The claymore attack on June 15, 2006 on a morning commuter bus killed 68 civilians including school children and injured at least 65 people. The suspect was accused of signaling his accomplice from a nearby tree top to trigger the bomb
45734	2012	1	pakistan	Police found the dead body of a teenager boy, identified as Shahzaib Baloch (17), from Mawatch Goth within the jurisdiction of Mauripur Police Station in Karachi on January 16, reported Daily Times. A Police official said the victim was missing since January 14, 2012, his hands and legs were tied with ropes with two bullet shots in his head and was a resident of Ali Mohammad Mohalla in Baghdadi Lyari area. Police said Lyari gang warfare was the motive behind the murder.
54666	2011	4	india	171 activists of CPI Maoist backed Chasi Mulia Adivasi Sangha (CMAS) lodged in Koraput jail have started hunger strike from April 4 demanding their release, reports The Hindu. These imprisoned CMAS activists have taken up this agitation under leadership of spokesperson of the outfit Tapan Mishra. They alleged that they were lodged in jail since past two years and they were victims of lingering judicial process. Moreover they also pointed out that their release was among the 14 points in the agreements reached between the State Government and the Maoists for the release of abducted Malkangiri District Collector R. Vineel Krishna and Junior Engineer Pavitra Majhi in the month of February. Deputy Inspector General (DIG) of Prisons Dharanidhar Das confirmed that these under trial prisoners were continuing their hunger strike despite attempts of jail officials to motivate them to call off the hunger strike.
47034	2012	4	pakistan	The Supreme Court on April 9 refused to give an opportunity of hearing to former President Pervez Musharraf in a case regarding the registration of second First Information Report (FIR) in the December 27, 2007 Benazir Bhutto murder case against him and 12 others because he had already been declared as a proclaimed offender by a lower court in 2011, reports Daily Times. The court observed that Musharraf should have surrendered before the court, which had issued arrest warrants for him. A three member bench comprising Chief Justice Iftikhar Muhammad Chaudhry, Justice Khilji Arif Hussain and Justice Tariq Parvez also directed the respondents to file their replies by April 16, 2012.
56402	2011	7	india	General Officer Commanding (GOC) 15th Corps Lieutenant General S A Hasnain warned of more infiltration attempts from Pakistan occupied Kashmir (PoK) in the coming months. So far eight such attempts were foiled by the alert troops, he added. We expect more infiltration attempts in the future as militant organisations, particularly LeT, are desperate to re establish their new leadership , he added further. Describing the recent killing of five top ‘commanders’ of the LeT at Lolab in the frontier District of Kupwara, as a major success, he said there is now leadership crisis in the outfit. Our main objective will be to prevent the outfit in reorganizing their leadership.
13099	2014	3	india	Special Operations Cell of Punjab Police arrested a person, Lovedeep Singh acting as a spy for Pakistani Inter Services Intelligence (ISI) and recovered photographs of restricted areas, restricted Army manuals and a hand made sketch of military installations, an official said on March 26, reports dnaindia.com. He was working as a clerk in Army cantonment in Faridkot (Faridkot District). Preliminary questioning showed he was engaged by the ISI about 18 months back and was providing them with information with regard to movement of Army units in Faridkot, Ferozpur and Fazilka sectors, construction of new bunkers on Indian side of the border, photographs of army vehicles along with their formation signs, army exercises and trainings, besides any new activity construction works in these sectors.
48410	2012	6	pakistan	Lashkar e Islam (LI) militants abducted three volunteers of Akkakhel Peace Committee at gunpoint from Sultankhel area in Khyber Agency of Federally Administered Tribal Areas (FATA) on June 27, reports Dawn. The abducted volunteers, identified as Naseem Khan, Mohammad Imran and Faraz, were on routine patrol in the area when they were intercepted and taken away at gunpoint.
29421	2013	9	india	The Breakaway faction of Achik National Volunteer Council (ANVC B) has reiterated that it neither allows its cadres to extort nor resort to dacoity like its splinter group, United A chik Liberation Army (UALA), reports The Shillong Times. In a statement issued on September 12, the ANVC B said that the outfit’s policy is different from that of other organisations because of its leaders who are more conscious of the change needed for a better society. “UALA cadres are nothing but dacoits who do not spare even INR 5 from poor villagers and they are the ones who continue to extort in our name using our old letter pads,” the outfit said.
42372	2012	7	india	Authorities on July 28 found a 400 meters long tunnel, running between India and Pakistan, along the International Border in Samba District of Jammu and Kashmir, according to Rediff. We have discovered a tunnel running between Pakistan and India in Samba District, Senior Superintendent of Police (SSP, Samba) Israr Khan said. The tunnel was detected after an area caved in at two or three places due to rains near the Border Security Force s Chillayari Border out Post (BoP), he added. After the cave in, the area was dug out to know the reason. But, the authorities were surprised to find a tunnel, the SSP said. The tunnel, with a dimension of 3x3 feet, was running between Chillayari BoP and Pakistan s Numberiyal BoP, he said. Dug at a depth of 25 feet below the ground level, it was 400 metres long on the Indian side, the SSP said adding, We are confirming whether the tunnel is operational or not. The tunnel, which seemed to be freshly constructed, had air supply through a 2 inch pipe, he said adding “we are looking into all aspects”. Since it is difficult to push in terrorists to the Indian side, they decided to set up a tunnel to facilitate infiltration, the SSP said.
24020	2013	10	bangladesh	Police on October 9 arrested five cadres of Islami Chhatra Shibir (ICS), the student wing of Jamaat e Islami (JeI) at Rajshahi University (RU) in Rajshahi District over October 8’s attack allegedly by the ICS cadres on a RU unit leader and a former activist of Bangladesh Chhatra League (BCL), the student wing of the ruling Awami League (AL) in Rajshahi city, reports The Daily Star. BCL Organising Secretary Shariful Islam Saddam was stabbed all over the body and Golam Robani Khan was hit by a bullet on his left leg. The arrestees are identified as Abdullah, Ariful Islam, Monirul Islam, Shanto Islam and Muhamad Sujon.
24516	2013	1	india	A Pakistani national, identified as Mohammed Hussain alias Julfikar Ali, who was on death row since 2006 until the Supreme Court set aside his conviction and ordered his retrial in August, 2012, was acquitted by a Sessions Court in New Delhi on January 4, reports The Hindu. The court noted “substantial lapses” in the Delhi Police investigation into the 1997 blast in a Blueline bus near Punjabi Bagh in West Delhi killing four persons and injuring 24. Among the lapses, Additional Sessions Judge Pawan Kumar Jain found that the Delhi Police did not prepare a site plan, did not consider taking photographs of the inner portion of the bus, exhibits lifted from the spot were not sealed and no effort was made to prepare the sketch of the suspect. “The prosecution has failed to bring home the guilt of the accused beyond the shadow of reasonable doubt,” the Judge said.
14071	2014	5	india	Indian Mujahideen (IM) operative Haider Ali alias Black Beauty revealed to his interrogators that major terror outfits operating in the Kashmir Valley like Lashkar e Toiba (LeT), Jaish e Mohammed (JeM) and Hizb ul Mujahideen (HM) had joined hands with Indian Mujahideen (IM) and Student Islamic Movement of India (SIMI) with the objective of eliminating Prime Minister (PM) elect Narendra Modi Deccan Chronicle reports on May 23. Following the Patna (Bihar) blast of October, 2013, Pakistan s Inter Services Intelligence (ISI) top operatives directed that all major terror outfits should pool their resources in targeting Modi, he added. Ali, disclosed that ISI top brass was extremely unhappy with the failed attempt on Modi’s life at the Patna rally. The ISI, he claimed, felt that IM and SIMI which had jointly carried out the explosions was not competent enough to carry out such “major operations”. “The threat to Mr Modi is very high as these terror outfits are still on the lookout for an opportunity to target him. A few days ago some key SIMI operatives had openly raised slogans threatening the PM elect during a court hearing in Madhya Pradesh. So the threat perception remains high and we are closely monitoring activities of these subversive groups,” a top security official said.
28010	2013	7	india	Traces of RDX and ammonium nitrate have been found at the explosion sites in and around the Mahabodhi temple complex in Bodh Gaya in Gaya District on July 7, reports The Times of India reported on July 8. Some instructions in Urdu were found along with the bombs recovered and defused in Bodh Gaya. One such instruction read Bara But (big statue) and the other bus . Police believe that the first meant Great Buddha statue and the second the tourist bus. Another writing, again in Urdu, said that the operation was done as revenge for what had happened in Iraq. Further, examination of three unexploded bombs revealed that the planters used small LPG cylinders as containers to detonate explosives suspected to be a mix of ammonium nitrate and another high intensity material. Small cylinders ranging from 2.5 to 5 kg have been used. The gas was taken out and the cylinders filled with explosives. The circuit was then completed using a detonator and a timer device, said an officer from the National Investigation Agency (NIA). Sources said this is the first time gas cylinders have been used as containers for explosives a departure from the signature style of Indian Mujahideen (IM), the outfit being suspected to have carried out the blasts. IM is known to use tiffin boxes, pressure cookers or boat shaped aluminum containers to pack explosives with large amounts of shrapnel. This method of bomb making gives specific direction to the impact of the blasts and causes maximum casualties.
62997	2011	10	pakistan	Khyber Pakhtunkhwa Minister for Housing and Physical Planning Amjad Khan Afridi of the Pakistan People’s Party (PPP) escaped an attack when terrorists opened fire at him in Kohat District. “Three shots were fired at the Minister in Biliting area on Kohat Rawalpindi Road. However, the Minister survived the attack as he was travelling in a bullet proof vehicle. Police official Mubarak Zeb and an Intelligence official in Peshawar blamed the attack on Tehreek e Taliban Pakistan (TTP).
25612	2013	3	india	In order to ensure proper rehabilitation for Naxals Left Wing Extremists (LWEs) willing to abjure violence, the Centre has revised a new surrender and rehabilitation policy which will take effect on April 1, reports The New Indian Express, on March 5. The plan under the Security Related Expenditure Scheme approved by the Union Finance Ministry substantially increased the immediate grant and stipend for surrendered ultras. Under the revised scheme, senior cadre or politburo members will be paid INR 2.5 lakh as an immediate rehabilitation package while junior cadre will get INR 1.5 lakh. “The revised scheme will also address the specific needs for rehabilitation of surrendered LWEs so they should not feel deprived of employment in the mainstream society,” a source said. To ensure entrepreneurial opportunities, the Ministry of Home Affairs (MHA) will also give the surrendered ultras a stipend of INR 3000 per month for three years. Earlier this was INR 2000 per month. “Additional incentives of INR 30,000 would be given for surrendered weapons including AK 47 56 or sniper rifles. The amount will be deposited in the form of Fixed Deposits,” the source said. An MHA official said the Finance Ministry has also approved a proposal for community policing in 106 Districts of nine Communist Party of India Maoist (CPI Maoist) affected States. “The grant for community policing in the LWEs affected states has been enhanced from the earlier INR 5 lakh to INR 10 lakh per District per year,” the official added. The Centre is also encouraging the surrendered ultras to undergo vocational training so that they can be employed and become financially independent.
