index	year	month	location	news
35621	2013	12	pakistan	Doctor Munaf Tareen was recovered on December 1 from Uthal area of Lasbela District, reported Dawn. A senior leader of Pakistan Medical Association (PMA) Dr Haqdad Tareen said that the abductors had dropped Dr Munaf Tareen at a deserted place in Uthal area of Lasbela District. Yes he is safe and sound , Dr Tareen said. The kidnapped doctor was shifted from Uthal to Karachi after his recovery. Dr Tareen was abducted on September 17, 2013 from Pishin Stop in Pishin District. There was no claim of responsibility for the doctor s kidnapping. Sources said that Dr Tareen s recovery is a result of ransom payment as the kidnappers had demanded a ransom of PKR 50million
62817	2011	10	pakistan	Two people were killed in target killings in different parts of Karachi, the provincial capital of Sindh on October 13, reports Daily Times. A private bank employee, identified as Salam, was shot dead at Maymar Morr within the limits of Gulshan e Maymar Police Station.
45784	2012	1	pakistan	Unidentified militants blew up a 16 inch diameter gas pipeline near Pir Koh area in Dera Bugti District of Balochistan on January 20, reports Daily Times. According to the sources, an explosive device was planted on a gas pipeline, which exploded disrupting gas supply from the wells no 15 and 17 to the gas purification plant.
33506	2013	6	pakistan	A Government primary school building on June 20 destroyed in a blast in Karbogha of Doaba area in Hangu District, reports Daily Times. According to Police sources, explosives had been planted inside the building of Government Primary School which went off early in the morning, completely destroying a classroom while partially damaging another room. However, no one was injured in the blast.
1922	2015	3	india	Son of the Nokma (village headman) of Oragitok in West Garo Hills, identified as Sengbath Marak was killed in an encounter between suspected militants of the Garo National Liberation Army (GNLA) and Police in Rongram in West Garo Hills District, on March 4, reports The Assam Tribune. He was killed in the encounter when Police stormed a house in the village of Romba Ading to flush out GNLA militants who had taken shelter there. According to police there were four militants along with the Nokma’s son inside the house when it was raided. The other militants managed to escape by opening fire and fleeing into the nearby jungle, close to Nokrek Biosphere. Police further added that he was involved with the armed group because he opened fire on the Police. A 7.65 pistol with two live rounds, two magazines, three GNLA demand notes and a detonator were recovered from the encounter site.
1604	2015	2	india	Suspected Indian Mujahideen (IM) operative Ajaz Shaikh, who has been named accused in the Dilsukhnagar blasts (February 21, 2014) case, has not only been a hawala (illegal money transaction) money organiser, but also the one who arranged fake identity cards for others involved in the twin blasts, The Times of India reports on February 16. The National Investigation Agency (NIA), is likely to bring Shaikh to Hyderabad and produce him in a local court on February 16 (today). The NIA had named Shaikh as the sixth accused in the case. Using various software tools, Shaikh created fake IDs and supplied them to IM operatives since 2010. With these fake documents, Asadullah had entered into a rental agreement with a flat owner in Mangalore in November, 2012, and subsequently came to Hyderabad to execute the twin blasts, intelligence sources said.
13451	2014	4	india	On April 17, the Maoists carried out Improvised Explosive Device (IED) explosions in two locations of Giridih District, reports The Hindustan Times. In the first incident, the Maoists triggered two IEDS about 300 metres away from Harladih CRPF camp under Kukhra Police Station limits. In a separate incident, the Maoists triggered seven IEDs near Gamhariya village under Pirtand Police Station area. “Raids have been launched in both the areas by joint SFs to arrest the Maoist cadres who carried out the blasts,” Kranti Kumar Garhdeshi, the Giridih Superintendent of Police (SP) said.
5521	2015	9	india	The para military forces and the Maoists were engaged in an encounter at Tikri forest in Burudih under Ghatshila Police Station area of East Singhbhum District on September 18, reports The Pioneer. The security personnel recovered a rifle, a pistol, gelatin sticks, explosives including bomb making material, and Maoist literature from the encounter spot.
11735	2014	12	bangladesh	A woman and her two children were injured after criminals set fire to their CNG run auto rickshaw in Dhaka city s Kazipara area on December 28. They were injured when they were stuck in traffic at Kazipara area some criminals came and poured petrol on the vehicle and set fire to it.
46704	2012	3	pakistan	At least two buses of Karachi University (KU) were attacked by armed assailants injuring two on board students on March 17. Karachi University had announced on March 16, 2012 that the university would remain open and all academic activities would continue despite Muttahida Qaumi Movement’s (MQM) call to observe a Black Day and the business community’s strike in the metropolis.
37136	2013	11	srilanka	Dismissing a deadline set by the British Prime Minister David Cameron, the Leader of the House, Minister Nimal Siripala de Silva on November 16 said it is confident of facing any challenge before the UN Human Rights Council (UNHRC) in Geneva, reports Colombo Page. The Minister asserted that Sri Lanka would resist any international inquiry as a policy. He explained that there was no need for an international inquiry within such a short span of time and that the government has done well in the reconciliation process, a fact Cameron himself has admitted.
47291	2012	4	pakistan	Four persons, including a Head Constable, were killed in separate acts of target killings in Karachi on April 26, reports Daily Times. A senior Pakistan People’s Party (PPP) leader, Malik Muhammad Khan Niazi, was shot dead when he gathered up people to hold protest against the conviction of Prime Minister Yousuf Raza Gilani in a contempt of court case at Aath Chowk near Noorani Hotel within the precincts of Kalakot Police Station.
61962	2011	8	pakistan	Another man, identified as Farhan Baloch, was shot dead in a drive by shooting near Safora Chowrangi in Sacchal Police remits.
56793	2011	8	india	Director General of Police (DGP) Kuldeep Khoda on August 5 said that situation is improving in the State, Daily Excelsior reported. There are big success on the counter insurgency and counter infiltrations. There is a decrease of 70 per cent in militancy related incidents in Jammu region as well as decrease in the number of operating militants. But, efforts (to infiltrate) are being made from across the border and instructions are being given to the militants to engineer infiltrations. There have been several attempts of infiltration along the border in Kashmir. These attempts are aimed to push more and more militants to this side before passes get closed.” There are varying numbers (of militants staged on launching pads for infiltrations in J K). Some guesses have been in the range of 300 (militants), he said. To a question that how many militants have sneaked in 2011, he said, This can never be confirmed. But they (sneaking militants) are down than last year.” Also, maintaining that the situation was well under control in the Kashmir valley, he said there are elements interested in fomenting trouble to keep the pot boiling in the region. Situation is well under control. There are some people, interested elements for obvious reasons, (who want to create trouble in Kashmir again), Khoda said. The elements who have been operating for more than the past 20 years are not still gone, they get funding from outside. Their job is to keep the pot boiling. One has to understand clearly that Kashmir is a conflict zone. It is not that terrorism is over. In any conflict zone, there will be some problem and we have to deal with these problems very effectively, he added.
9908	2015	4	nepal	In a bid to end the current deadlock situation seen at the CA, UCPN M Chairman Pushpa Kamal Dahal and CA Chairman Subas Nembang held a discussion at latter’s quarter at Baluwatar on April 9, reports ekantipur.com. Chairman Nembang had drawn the Dahal’s attention to hold a meaningful dialogue with the ruling parties to forge consensus prior to the CA meet. Meanwhile, Dahal requested Nembang to create an environment conducive for talks and also urged him not to hold a CA meeting unless the consensus was forged.
29395	2013	9	india	Special Task Force (STF) Police and Central Reserve Police Force (CRPF) personnel, during a combing operation on the Andhra Odisha Border (AOB) region, recovered a Communist Party of India Maoist (CPI Maoist) arms dump consisting of eight country made big guns at Chemuduguda forest area in G.L. Puram mandal (administrative unit) in Vizianagaram District on September 10, reports The Hindu. D V Srinivaa Rao, Officer on Special Duty (OSD), Parvathipuram, in a statement said that AOB Special Zonal Committee and Srikakulam Koraput joint Divisional Committee members might have hidden the said weapons with an intention to attack the Police.
22152	2014	12	pakistan	Lal Masjid cleric Maulana Abdul Aziz will neither surrender to the Police nor will he seek pre arrest bail, a statement issued by the mosque’s spokesperson Mufti Tehseenullah said on December 27, reports The Express Tribune. Mufti Tehseenullah said that the case was “politically motivated” and that a few members of the “so called civil society” had exerted pressure on the Police to register a “baseless case” against the cleric. “Maulana Abdul Aziz has decided in principle that he will neither surrender to the Police nor get a pre arrest bail in the baseless case.” He also rejected claims made by civil society members about threats by guards of the mosque and said Maulana Aziz had condemned the Peshawar attack and that there was no justification to register a case with the Police. “We will not tolerate if the administration takes any action under pressure,” Tehseenullah warned.
43593	2012	9	india	An elected tribal ward member of a Panchayat (village level local self Government institution), identified as Rohidas Gond, was killed by Communist Party of India Maoist (CPI Maoist) cadres at Rajpur village in Nabarangpur District of Odisha on September 20, reports The Hindu. According to reports, a group of Maoists went to the house of Rohidas and forced him to accompany them. They reportedly shot him dead on the outskirts of the village. In a note left at the scene, the Maoists branded him a Police informer. It is suspected that the Mainpur division of adjoining Chhattisgarh carried out the killing.
30716	2013	11	india	The Sangai Express reports that expressing grave concern over the series of bomb blasts in recent times, Deputy Chief Minister Gaikhangam, on November 19, speculated that subversive elements might be setting off bomb explosion out of frustration and to demonstrate their presence. He said, with insurgents unable to breach the tight security barricade in Imphal and greater Imphal areas or unable to engage Security Forces in encounters, disruptive elements might be carrying out the blasts for militant groups in the exterior locations just to create chaos in the society. Citing arrest of Progressive faction of People s Revolutionary Party of Kangleipak (PREPAK Pro) militants in connection with the Pallel (Chandel District) bomb blast case, he said interrogation of the arrested person is on to establish further proof about involvement of insurgent outfits in the blasts.
57864	2011	9	india	A search team of Para military Forces and the Chhattisgarh Police recovered five bombs planted by the Communist Party of India Maoist (CPI Maoist) cadres on a forest road in Kanker District on September 26, reports The Economic Times. Tiffin bombs were kept on a jungle road in Koilibera area. The bombs were recovered by a search contingent of the Border Security Force (BSF) and the district force, an official at the Police headquarters said.
10652	2015	3	srilanka	The Criminal Investigations Department (CID) of Sri Lanka has arrested three former Navy personnel and detained them in connection with the killing of Tamil National Alliance (TNA) Member of Parliament (MP) Nadarajah Raviraj and a Policeman providing security to him in 2006, reports Colombo Page on March 31. The parliamentarian was shot dead by gunmen riding a motorbike in Colombo in Western Province on November 10, 2006. His bodyguard, Police Constable Lakshman Lokuwella attached to the Jaffna Police Station, was also killed in the shooting. The Spokesman Assistant Superintendent of Police (ASP) Ruwan Gunasekara said the three security personnel including two officers are being interrogated under the Prevention of Terrorism Act (PTA) and they will also be questioned over several disappearances during that time. The new government of President Maithripala Sirisena has promised accountability for wartime abuses. Raviraj was outspoken on greater self rule for minority ethnic Tamils and explained the Tamil perspective of the conflict in Sinhala, the language of the majority. A former mayor of Jaffna and a lawyer by profession, Raviraj openly spoke out against the conflict between the military and Liberation Tigers of Tamil Eelam (LTTE) in the country s north and east.
11592	2014	10	bangladesh	War Criminal Ghulam Azam (92), who led the Jamaat e Islami (JeI) during the country’s Liberation War in 1971, died at the Bangabandhu Sheikh Mujib Medical University (BSMMU) in Dhaka city on October 23, reports The Hindu. On July 15, 2013, the International Crimes Tribunal 1 (ICT 1) handed down 90 year jail sentence to Azam, saying that though he deserved death he was being given the jail sentence due to his old age. Azam was a year and three months into his 90 year jail term for crimes against humanity. Azam is the second War Crime convict to die after convicted War Criminal and Bangladesh Nationalist Party (BNP) leader, Abdul Alim, passed away while undergoing cancer treatment at the BSMMU in Dhaka city on August 30.
19563	2014	3	pakistan	A person was killed in a grenade attack in Prang area of Charsadda town (Charsadda District) on March 5, reports Dawn. Police said the victim was collecting sand when a grenade concealed in a pile of sand went off and killed him.
37701	2012	1	india	An infiltrator was injured as injured as troops foiled Pakistani firing backed infiltration bid of militants on the Line of Control (LoC) at Tarkundi in Gambhir sector of Poonch District in the night of January 3, reports Daily Excelsior. Troops observed a group of four to five militants, trying to infiltrate into Indian Territory, and challenged the militants who opened fire. This forced the militants to retrieve to Pakistan occupied Kashmir (PoK). One of escaped militants got injured in the firing. Pakistan Army also resorted to ceasefire violation to give cover to the infiltrators, official sources said. As many as 45 truce violations were reported in 2011 along the LoC in Jammu and Kashmir. Nine Security Force personnel were killed and nearly 50 injured in various firing incidents along the border between 2008 and 2011.
36142	2013	3	nepal	Cadres of the Mohan Baidya led Communist Party Nepal Maoist (CPN Maoist Baidya) on March 29 obstructed the employees of the Election Commission (EC) from carrying out voters’ registration process in Lalitpur and Bhaktapur Districts, reports The Himalayan Times. In Lalitpur District, a group of around 20 CPN Maoist Baidya cadres misbehaved with EC officials and smashed a laptop computer used for maintaining records of voters and taking their photographs to be affixed on voters’ ID cards in Chaughare Village Development Committee (VDC). In Bhaktapur District, four CPN Maoist Baidya cadres vandalised Bhaktapur District Election Office. The masked men broke into EC office and damaged one laptop, a photocopy machine and a printer. They also tore apart 68 forms meant for registering voters’ details.
30286	2013	10	india	CRPF have killed 46 Naxals Left Wing Extremists (LWEs) and arrested 174 of them including Maoists from different parts of the State so far this year, reports The Times of India on October 30. They have also found a haul of 1,730 kilogram explosives, 298 landmines, 100 regular weapons and 1700 ammunition from the LWEs from different parts of Jharkhand. CRPF Inspector General (operations) MV Rao revealed the numbers in an official press release at a press conference. A total of 22 battalions of CRPF and two battalions of CoBRA are engaged in the war against the LWEs in Jharkhand. At a programme which marked its 74th anniversary, CRPF Jharkhand IG (operations) said the force has achieved huge success in its fight against the LWEs in the state.
49472	2012	8	pakistan	Eleven Tehreek e Taliban Pakistan (TTP) militants, three Security Force personnel and a member of Salarzai Qaumi lashkar (community militia) were killed and several others injured as fighting intensified in Salarzai tehsil (revenue unit) of Bajaur Agency in Federally Administered Tribal Areas (FATA) on August 28, reports Dawn. Sources said that fierce clashes between Security Forces (SFs) and TTP have taken place in several areas of Salarzai tehsil in which both sides used heavy weapons. According to a TTP ‘spokesman’, 15 security personnel were killed in the fighting, but official sources rejected the claim.
57963	2011	10	india	Four Central Reserve Police Force (CRPF) troopers were injured in an ambush carried out by the cadres of the Communist Party of India Maoist (CPI Maoist) near Bhiwankojhi village in Kurkheda tehsil (revenue unit) in Gadchiroli District in the morning of October 2, reports The Times of India. According to sources, a convoy of seven vehicles belonging to CRPF battalion was returning from Gyarapati Police assistance centre to Kotgal, when it was attacked by the Maoists near Bhiwankojhi village in the wee hours. Maoists reportedly carried out the blast to stall the movement of the CRPF convoy and fired indiscriminately on the forces. A clamour mine and a hand grenade left by Maoists were also recovered from the incident site.
22185	2014	12	pakistan	Security Forces (SFs) arrested 14 suspected militants, including a key commander , during an operation in the Eastern Bypass area of provincial capital Quetta on December 29, reports Dawn. “Forces acted on an intelligence tip off,” said an unnamed intelligence officer, adding that a militant belonging to Jundullah, who was the mastermind of the November 26, 2014 attack on polio workers in Quetta was among the arrested militants. The SFs also recovered arms and ammunition from their possession.
5721	2015	10	india	The account from which messages relating to Areeb Majeed one of the four youth who had joined the Islamic State (IS) were being posted has been traced to the Ansar ul Tawhid (AuT), oneindia.com reports on October 3. A handle spamci17 had put out a series of tweets claiming that Areeb Majeed had returned to India only to carry out a suicide attack on a Police Station. Indian Intelligence Bureau (IB) officials say that the account was being handled by a member of the Ansar ul Tawhid or the erstwhile Indian Mujahideen. According to IB report, AUT was started a year ago by Sultan Armar. However with conflicting reports of his death being posted on the IS media, the outfit is said to be handled now by brother Shafi Armar. There has been a pause in the recruitment process from India and hence messages on social media accounts are being posted to give a brighter side to the IS. The account from which the Areeb Majeed messages were tweeted has now been taken down. Intelligence Agencies say that it is the same person who continues to tweet under different handles. He has tweeted similar material in the past as well and the account has been taken down. With the IS s social media team, it is always a catch and mouse game. There are nearly 45,000 accounts sympathetic to the IS that are being run on the social media. Around 200 are related to India. These accounts disappear and then resurface. There is a need to constantly monitor these accounts. These accounts post propaganda material and also suggest routes and means on how to reach the IS camps, the officer also adds.
5558	2015	9	india	India and Pakistan agreed to exercise restraint and work for defusing the situation on Line of Control (LoC) which has been witnessing repeated ceasefire violations as senior Army officers of the two countries held a Brigade Commander level Flag Meeting at Chakan Da Bagh in Poonch sector on September 21, after repeated ceasefire violations by the Pakistan army which resulted into several civilian casualties apart from a Border security Force (BSF) personnel, reports Daily Excelsior. Indian side took serious exception to unabated ceasefire violations by Pakistan army along the LoC in twin border Districts of Poonch and Rajouri in which six civilians were killed at Balakote sector while one BSF personnel was killed at Manjakote sector. This is the first Flag Meeting held at the level of Brigadiers after nearly 20 days of heavy firing and shelling of 120 mm, 82, 61 mm mortar bombs, Rocket Projectile Grenades (RPGs) and automatic weapons by Pakistani troops in Poonch District along the LoC. The meeting lasted for about an hour and a half and the Indian side was represented by Brigadier H S Sareen, Brigade Commander Bhimber Gali (BG) Brigade and other senior officers while the Pakistani side was led by Brigadier Osman and other officers. Pakistani troops have violated the ceasefire 25 times in September this year, shelling Indian civilian and military positions using 120 mm, 82 mm mortars, RPGs and automatic weapons, according to Indian officials. The last Brigade Commander level meeting was held on September 4, last year after the LoC saw 45 days of heaviest firing by Pakistani troops since 1971.
3888	2015	6	india	The Border Security Force (BSF), on June 21, arrested three Indian arms smugglers along with two pistols near the Taltoli Border Outpost in the Bamangola Police Station area of Malda District, reports The Times of India. The three were identified as Saiful Mondal (40), Bhudeb Roy (23) and Nirmal Sarkar. A motorcycle was also seized from the trio, who were attempting to smuggle the weapons across the border into Bangladesh. Several SIM cards were also seized from the smugglers. An unnamed BSF official said, In 2015, the BSF South Bengal Frontier has seized 29 pistols. Our intelligence branch is keeping a close watch on the movements of criminals along the international border.
35851	2013	12	pakistan	Unidentified militants abducted four Custom Officials, including Deputy Superintendent Chaudhry Iftikhar, near Motorway in Islamabad on December 20, reported The News. The sources said that the Custom authorities had seized a container of smuggled items including clothes and electronic equipment a few days ago.
16971	2014	9	india	A top Communist Party of India Maoist (CPI Maoist) cadre, identified as Kamlesh alias Tati Gandhi (28), was arrested by a team of Bijapur Police when he arrived in Dantewada District headquarter on September 29, to allegedly execute some operation at the ongoing Navratri fair in the town, reports Business Standard. Kamlesh, an active member of the ‘platoon number 12’ of the CPI Maoist, was involved in several incidents of crime, including murder, abduction, murder attempt, loot and attack on the Police party. He was carrying a reward of INR 40,000 on his head and around 31 cases and 10 warrants were pending against him.
3593	2015	6	india	The Enforcement Directorate (ED) issued fresh summons to Kashmiri separatist leader Shabir Ahmad Shah for questioning in connection with a case pertaining to the alleged terror financing through hawala (illegal money transfer) channel, Asian Age reports on June 5. The case relates to August 2005 of Delhi Police’s Special Cell when they arrested Mohammed Aslam Wani, an alleged hawala dealer who had claimed that he had passed on INR 2.25 crore to Shah. Wani was arrested with INR 63,00,000 received through hawala channels from the West Asia and a large amount of ammunition on August 26, 2005, along with 5 kg RDX, 10 detonators and a foreign made pistol with 15 live cartridges from an East of Kailash apartment in Delhi. According to sources, the summon has been issued through the directorate’s office based in Jammu and Kashmir. It is believed that Shah, chairman of Democratic Freedom Party of Jammu and Kashmir, has been asked to appear before the agency next week. Wani, who is currently out on a bail, has also been summoned by the ED, which had registered a case under Prevention of Money Laundering Act (PMLA) against him. Sources said Shah had allegedly asked Wani to channel hawala money to him from Delhi for which he was paid three per cent as commission. It is alleged that Shah had also given Wani the phone number of one Saifi based in Muzaffarabad in Pakistan occupied Kashmir (PoK) who gave him instructions to collect the money.
10532	2015	9	afghanistan	At least 15 Tehreek e Taliban Pakistan (TTP) militants were killed in a United States (US) drone strike in Gomal District of Afghanistan on September 9, reports The News, quoting intelligence officials. “Fifteen dead bodies of killed militants will be shifted soon to their native areas in Dera Ismail Khan (District in Khyber Pakhtunkhwa Province),” one intelligence official said. Three officials confirmed the 15 militants belonged to the Gandapur faction of TTP that is led by Mullah Fazlullah.
