index	year	month	location	news
33544	2013	6	pakistan	In a separate incident, a person, identified as Abdul Whaeed, was shot dead by unidentified assailants in Dawood Goth area of Malir town.
22028	2014	12	pakistan	Umar Mansoor, a key Tehreek e Taliban Pakistan (TTP) commander and a close aid of Mullah Fazlullah was the mastermind of December 16 militants’ attack on Peshawar Army Public School, The Express Tribune reports on December 20. A video posted on December 18 on a website used by the TTP shows a man with a luxuriant chest length beard, holding an admonishing finger aloft as he seeks to justify the December 16 attack. The caption identified him as Umar Mansoor. “If our women and children die as martyrs, your children will not escape,” he said. “We will fight against you in such a style that you attack us and we will take revenge on innocents.” Six TTP cadres interviewed by Reuters confirmed that the mastermind was Mansoor who is close to TTP ‘chief’ Mullah Fazlullah. “He strictly follows the principles of jihad,” one said. “He is strict in principles, but very kind to his juniors. He is popular among the juniors because of his bravery and boldness.” Mansoor got a high school education in the capital, Islamabad, two TTP members said, and later studied in a madrassah. “Umar Mansoor had a tough mind from a very young age, he was always in fights with other boys,” said one TTP cadre. Mansoor has two brothers and spent some time working in the city of Karachi as a labourer before joining the Taliban soon after it was formed, in late 2007, said one commander. His nickname is “nary,” a word in the Pashto language meaning “slim”, and he is the father of two daughters and a son, said another commander. “(Mansoor) likes to play volleyball,” said one of the Taliban members. “He is a good volleyball player. Wherever he shifts his office, he puts a volleyball net up.” The Taliban video describes him as the “amir”, or leader, of Peshawar and nearby Darra Adam Khel. Mansoor deeply opposes talks with the Government, the commanders said. “He was very strict from the start when he joined,” a commander said. “He left many commanders behind if they had a soft corner (of their heart) for the government.”
40940	2012	6	india	New Chief of Army staff (COAS), General Bikram Singh, on June 1 promised a thorough and transparent probe into the allegation of a fake encounter in Dimapur District, Sangai Express quoting Headline Today reported. The Dimapur based 3rd Corps Intelligence Unit (CIU) on March 13, 2010 allegedly picked up three individual, identified as RK Roshan alias Ronald, Thounaojam Prem alias Roman and Th Naobi of Manipur, from Dimapur and subsequently killed them. The decomposed body of the trio was recovered on March 21, 2010 from Karbi Anglong District in Assam
7307	2015	1	pakistan	An activist of the Muttahida Qaumi Movement (MQM) Unit 6, identified as Danish (30), was shot dead and another man, identified as Touseef (26), was shot at and injured in Malir Town of Karachi, the provincial capital of Sindh on January 20, reported Daily Times.
59829	2011	2	pakistan	A man was killed in a target killing incident in Khameeso Goth jurisdiction of New Karachi Industrial Area police station. The victim Sarzameen was going on his motorcycle to Khameeso Goth, when armed militants opened fire at him causing injuries. Later, he succumbed to his injuries
62172	2011	8	pakistan	Awami National Party (ANP) Sindh President Shahi Syed said that the flawed policies of the Government were responsible for continuation of target killings in Karachi, reported Daily Times. “There is urgent need to devise a sincere policy and make efforts to save Karachi from the fire of lawlessness. The bodies of innocent people in gunny bags are found from streets of Karachi on daily basis, which is the height of lawlessness in any civilised society,” said Shaji Syed. Syed demanded calling Army in Karachi and said the Police had repeatedly proved itself totally incapable to control lawlessness in the city, adding, Karachi lawlessness is also dealing a deadly blow to the national economy.
7901	2015	3	pakistan	Unidentified assailants shot dead two persons, Muhammad Waleed and Wash Dil, in the Daramkol Baidarg area of the Turbat District on March 30, reports The News. According to police sources, the victims were on their way when armed assailants riding a motorbike opened fire on them and fled. Both of them died on the spot.
38908	2012	3	india	Police on March 2 neutralized a Garo National Liberation Army (GNLA) hideout, wherein 100 powerful detonators used for triggering Improvised Explosive Device (IED) blasts were kept, near Kharkutta in East Garo Hills District. Police teams were conducting a search operation of Arengdo village, near Kharkutta at 6 30am when they spotted the GNLA camp outside the village. Before the Police could move in, the GNLA militants, in a group of six to eight, fired heavily on the teams and the encounter lasted for 30 long minutes. The militants escaped leaving behind the powerful detonators, a pistol and a large number of demand notes of the GNLA.
47315	2012	4	pakistan	United States (US) Defense Secretary Leon Panetta said on April 27 that there is “no silver bullet” to completely destroy al Qaeda but argued that killing Osama bin Laden helped set the network back, reports Dawn. “Having been involved in the operations, even before we did bin Laden, it’s clear that there is no kind of silver bullet here to suddenly being able to destroy al Qaeda, and that includes even going after bin Laden,” he said. “But the way this works is that the more successful we are at taking down those who represent their spiritual and ideological leadership, the greater our ability to weaken their threat to this country and to other countries,” he added further. Panetta said he was certain that America was safer as a result of the bin Laden operation. “When you combine that with the other operations that have taken place, that have gone after al Qaeda leadership, I think it really has weakened al Qaeda as an organization and certainly it has prevented them from having the command and control capability to be able to put together an attack similar to 9 11,” the Defense Secretary pointed out. However, he cautioned, that this did not mean that there was no longer a terrorism threat. “It doesn’t mean that we somehow don’t have the responsibility to keep going after them wherever they are,” Panetta said.
23101	2014	7	srilanka	Sri Lankan Defence Secretary Gotabhaya Rajapaksa on July 1 ruled out any possibility that its soil could be used for terror attacks against India, after the recent discovery of an alleged terrorist plot to attack foreign missions in south India, reports Enewspaper of India. He said The Indian intelligence agencies have told me that there is a possibility of Islamic terrorism being based in Sri Lanka to act against India. However, we investigated these concerns and found that there is no merit in these concerns or claims. Indian authorities recently started investigating an alleged plot by a Pakistan based terror group to carry out suicide attacks on US and Israeli Consulates in south India. The conspiracy was reportedly planned overseas including in Sri Lanka, Malaysia and the Maldives. The plot was foiled by effective coordination of the Intelligence Bureau (IB) with countries such as Malaysia which tipped off India about the plan being hatched from Sri Lankan soil to attack the consulates in Chennai (Tamil Nadu) and Bangalore (Karnataka).
48912	2012	7	pakistan	Police found two dead bodies, identified them as that of Abdul Aziz (38), and Idrees (25), in gunny bags, abandoned near Sher Shah Bridge, Northern Bypass within the precincts of Mauripur Police Station. An official informed that unidentified armed militants abducted the victims, tortured and shot them dead and then abandoned their bodies near Sher Shah Bridge.
54266	2011	3	india	DNA reports that in a meeting chaired by the Chief Minister Naveen Patnaik on March 2, it was decided that the State Government would not withdraw Security Forces (SFs) from areas dominated by the Communist Party of India Maoist (CPI Maoist), though it announced to halt combing operations since February 20 following abduction of Malkangiri District collector R Vineel Krishna and junior engineer Pabitra Majhi, a senior Home Department official said. According to commitments made to the mediators, the State Government will not take any coercive step till peace prevailed, Chief Secretary BK Patnaik said earlier. Besides 12 battalions of central para military forces (seven battalions of Central Reserve Police Force (CRPF) and five battalions of Border Security Force (BSF), adequate number of Odisha Police s elite anti Naxalite Left Wing Extremism force Special Operation Group (SOG), India Reserve Battalion (IRB), District Voluntary Force (DVF) and Special Police Officers (SPOs) were also deployed for anti Maoist operations. Now with the State Government deciding not to execute Operation Green Hunt, these Forces would keep a watch on the movement of Maoists and their activities, the official said. Presence of BSF and CRPF in Maoist hit areas is itself an indication that the State Government will act if required, the official added.
62822	2011	10	pakistan	Daily Times reports that the attack on a compound in South Waziristan Agency on October 14 that claimed the lives of at least three suspected militants was the 300th drone attack carried out by the US in the Pakistan’s tribal region, according to a report by an independent London based group of investigative journalists. The report released on October 15 by Bureau of Investigative Journalism has mentioned varying figures about the casualties in the attacks as it says that at least 2,318 people and a maximum of 2,912 people, the majority of them alleged militants, have been killed in these attacks. Between 386 and 775 civilians, including 173 children, were killed in the 300 drone attacks since June 17, 2004. The report says between 1,141 and 1,225 persons were injured. Of the 300 drone strikes since June 17, 2004, it says, 248 occurred during President Barack Obama’s first three years, rising to a frequency of almost one strike every four days.
60244	2011	3	pakistan	two mutilated and decomposed dead bodies were found in the limits of the Vindar Police Station in Lasbela District. The dead were identified as Arif Noor, a Gwadar Development Authority (GDA) official, and Nawaz Mari, a resident of Vindar.
7925	2015	4	pakistan	The family of a 19 year old German boy, identified as Ali Mohammad Din, who had gone missing on February 7, 2015, in Faisalabad Districts negotiating with a group of militants based in Afghanistan to seek his return, reported Dawn on April 3 (today). The militants, affiliated with Amarat Islami in Afghanistan, conveyed to the family that Ali had joined them for jihad (holy war) and would join the Islamic State (IS also known as ISIS) in a couple of weeks. They said they had no affiliation with the Tehreek e Taliban Pakistan (TTP). Ali was born in Libya and he had been living with his family in Germany for 10 the last years. He came to Faisalabad on January 8, 2015, for the first time. Some relatives of Ali said they had talked to a representative of the militants who identified himself as Qari Ibrahim a number of times with a request to send Ali home. But Qari said they had no such tradition. “How can we send Ali back if he wants to join IS,” the family quoted Qari as saying. The family is not ready to believe that Ali, who does not even know how to offer payers, can take such a step. “Handlers of the militants abducted Ali for money. He was carrying 500 Euros, PKR 20,000, a mobile phone and a visa card when he was kidnapped on February 7,” a relative of Ali said.
29691	2013	9	india	Odisha Government has demanded two additional battalions of Central Armed Police Forces (CAPFs) for deployment in Nuapada, Bargarh and Balangir Districts for effective anti Communist Party of India Maoist (CPI Maoist) operations, reports The Pioneer on September 26. The State Government also asked the Union Ministry of Home Affairs (UMHA) to provide a helicopter, preferably an MI 17, and precision to the anti Maoist operations. The State raised the issue of paucity of funds for security related issues in Maoist hit areas of Odisha during a meeting of the Union Ministry of Home Affairs (UMHA) in New Delhi on September 25 where top Police officials of nine Naxal Left Wing Extremism (LWE) affected States were present to devise a strategy to restore law and order and peace in the affected areas.
48151	2012	6	pakistan	The Times of India while quoting the United States (US) Counterterrorism officials on June 9, reported that the death of al Qaeda s ‘Deputy leader’, Abu Yahya al Libi on June 4, 2012 is likely to accelerate a shift in power from the group s dwindling leadership in Pakistan to its increasingly autonomous franchises, particularly the branch in Yemen, whose focus on attacking American interests is sure to continue. American counterterrorism officials said Libi had played a pivotal role as the organization s theological traffic cop, enforcing a unified message and ensuring that younger fighters in the affiliates did not go off the rails. For now, Ayman al Zawahri, Qaeda s nominal leader, still holds the broad influence that he has consolidated since Osama bin Laden s death on May1 2, 2011. But the hierarchical structure of global jihad may be loosening a bit. Libi s death in a drone strike has torn at the connective tissue between the group s embattled leadership in Pakistan and its far flung affiliates across the Middle East and Africa. Libi s killing may even augur increased violence as younger, more impetuous fighters vie to seize mantle of global leadership, said analysts. Osama Bin Laden himself, in the documents that US navy SEALs recovered from his house in Abbottabad, worried about the rise of lower leaders who are not as experienced and this would lead to the repeat of mistakes.
20092	2014	5	pakistan	Separately, a convoy of SFs, comprising 25 vehicles, escaped a landmine blast in the Naag area of Washuk District on May 2, reports The Express Tribune. The convoy was going to Panjgur District from Washuk when one of the vehicles narrowly escaped the landmine explosion. The vehicle was partially damaged but no casualty was reported.
14406	2014	6	india	Separately, the Union Government on June 4 termed the issue of unabated infiltration in North East from across the border a “national problem”, reports The Sentinel. Minister of State for Home Affairs Kiren Rijiju said that action would be taken against those infiltrators who were found staying in the Indian Territory. “The issue of illegal migrants and infiltrators in the northeast, especially the issue of Bangladeshis, is a cause of concern for all of us. This is a national problem,” he said, adding, “We have to look into these things from a national perspective. So action will be taken, but we have to work along with the State government.”
56916	2011	8	india	A militant was killed in an encounter in the forests of Tangwari Warson in Kralpora area of Kupwara District on August 11, reports Daily Excelsior. The encounter was going on till the reports last came in. Massive operations have been launched in the forests of Kupwara after a group of militants managed to infiltrate into these forests.
2600	2015	4	india	Police feel that 10 home grown terror suspects, holed up in Gulf countries, including Riyadh in Saudi Arabia, pose a big threat, The Times of India reports on April 13. These suspects are wanted in various terror cases booked in Hyderabad and other parts of the country. They are also on the wanted list of the National Investigation Agency (NIA), Counter Intelligence (CI) of Telangana Police and other security agencies. Diplomatic efforts have been made to bring these conspirators back to the country, but so far it did not yield much result. The LeT Lashkar e Taiba operatives, through their strong network in Riyadh, are always a major threat to Hyderabad as they make sustained efforts, using various channels in India, to stage terror strikes, a senior Police Officer stated. These suspects include terror suspects like Harkat ul Jihad al Islami (HuJI) operative Mohammed Abdul Majeed (brother of the late Shahid Bilal, who was involved in the Task Force blast case), LeT operatives Mohammed Bhai (wanted in the Sai Baba temple blast), Furkhan Bhai alias Abdullah, Asad Khan alias Abu Sufiyan, Siddique bin Osman and others. Similarly, Abdul Rehman alias Farhathullah Ghori, reportedly taking shelter in Karachi (Sindh, Pakistan) is wanted in various cases, including the 2002 Akshardam (Gujarat) temple attack case. Some of these suspects are also wanted in the 2012 conspiracy to target right wing leaders across India. According to intelligence sleuths, these suspects have been funding various terror modules for the last several years and are responsible for luring local youths into terror activities. On several occasions, they had lured Hyderabadi youths to Saudi Arabia and planned meet ups to execute terror strikes in the country. In every instance, police could nab only the local operatives. Their handlers in Riyadh remained elusive.
56126	2011	7	india	Police claimed to have injured a few Maoists in an encounter in Raigarh District. SP Rahul Sharma said a group of around 30 Maoists attacked a Police team which was conducting a combing operation near Pardhiyapali village. Police returned the fire, and the Maoists, outnumbered, escaped towards neighbouring Mahasamund District, Sharma added. The Police recovered one SLR rifle and 19 live rounds from the incident site.
49427	2012	8	pakistan	Baloch Republican Army (BRA) claimed responsibility for the August 26 attack on passengers in Bolan District, reported Dawn. Calling reporters from an unspecified place, BRA’s spokesman Sarbaz Baloch said “we carried out the attacks because the organisation’s call for a wheel jam and shutter down strike on the sixth death anniversary of Nawab Akbar Bugti was ignored,” adding, “Despite our appeal for wheel jam strike coaches were carrying people to Sindh and Punjab. Further, Baloch Republican Party (BRP) chief Nawabzada Baramdagh Bugti while addressing a conference held at University College of London over phone urged the Baloch people to shun their differences and unite under a single party to achieve their objectives.
42863	2012	8	india	Police arrested four youth for setting ablaze a Police vehicle on the occasion of Eid (August 20) and sent them to Central Jail Srinagar. Police sources said that hunt for eight others, who are accused involved in the setting ablaze of the Police vehicle and assaulting of policemen, is on. The 12 youth have been identified on the basis of Video footage and photographic evidence of the spot.
12080	2014	1	india	Two troopers of the Commando Battalion for Resolute Action (CoBRA) battalion were injured following a gun battle with Communist Party of India Maoist (CPI Maoist) cadres who had opened fire in the jungles of Chintagufa Police Station in Sukma District while the security forces were on search operation, reports The Pioneer on January 21. Arms and ammunition were seized in huge quantity during the searching of area, said Sub Divisional Officer of Police (SDOP) Sanjay Dhruv on January 20. The seized item include a 12 bore rifle, muzzle gun, Chinese hand grenade, bullets, Maoist literature, banner and other items were found.
3524	2015	6	india	A woman Communist Party of India Maoist (CPI Maoist) cadre was killed in an exchange of fire between a joint team of Security Force (SF) personnel and Maoists in the restive Mirtoor Police Station limits in Bijapur District on June 2, reports The Times of India. Several joint teams of Special Task Force (STF), Commando Battalion for Resolute Action (CoBRA) battalion of the Central Reserve Police Force (CRPF) and District Force were on a special anti Naxal Left wing Extremism (LWE) operation in forests of Mirtoor, Jangla and Gangaloor Police Station limits. While cordoning off Mirtoor region, SF personnel spotted a Naxal camp near Bechapal village following which they started encircling the spot. Some armed insurgents seeing the SF personnel opened indiscriminate firing at them, triggering a gun fight between both sides, a senior Police official said. Later, during search of the spot, body of a woman Maoist in uniform was found. One wireless set, two hand grenades, one 315 bore rifle and other materials were also seized from the spot, the officer said. The deceased Maoist cadre will be identified once the SFs will reach back to their camp along with the body, the official added.
19726	2014	3	pakistan	At least five militants were killed and eight others were arrested during a search operation by Security Forces (SFs) in Turbat District on March 22, reports Dawn. An un named official said that SFs launched a search operation in the Pidrak area of Turbat that led to an exchange of fire between militants and SFs. The forces quickly responded and killed five militants during the exchange of fire,” he added. He further stated that eight suspects were arrested up from the same area and are being interrogated by the security personnel.
26647	2013	4	india	militants fired at and hurled a grenade, which did not explode, at a Police party of Special Operation Group (SOG) of Jammu and Kashmir (J K) Police in Dangerpora Kanipora locality of Nowgam area located in the outskirts of Srinagar city (Srinagar District). However, no person reportedly was injured in the incidence.Reports said, “The SOG men signaled a Maruati to stop for checking. However people in the car opened fire with a pistol and lobbed a grenade. They managed to escape from the spot. The grenade did not explode and there was no loss of life or property,” Greater Kashmir added.
9251	2015	10	pakistan	Sindh Police spokesman on October 14 denied a news report claiming the Police issued or prepared a list of 53 Islamic State (IS) inspired militants, reports Dawn. The spokesman in his statement categorically denied issuance of such a list by any department working under Sindh Police. A report carried by almost all the newspapers of Pakistan on October 13, 2015, claimed that Police Investigators claimed to have traced more than 50 militants in Karachi ‘inspired’ by the self styled Islamic which wants a presence in the country.
5273	2015	9	india	The India government has finalized a robust policy for flying such objects, amidst revelations by several terrorists and investigations carried out by intelligence agencies on possible use of unmanned aerial vehicles (UAVs) unmanned aircraft systems (UASs) for terrorist attacks, The Times of India reports on September 5. The new guidelines for the UAVs UASs including paragliders, hot air balloons, remote controlled flying devices, microlight aircrafts etc will be out soon, said sources. The threat from paragliders is borne by the interrogation of terrorists including Lashkar e Taiba s Syed Zabiuddin Ansari alias Abu Jundal, Indian Mujahideen s (IM) Syed Ismael Afaque Lanka and Khalistani militant leader Jagtar Singh Tara. Jundal, revealed that LeT provides aerial training to select cadres. Independent inputs confirm Inter Services Intelligence s (ISI s) role as well in training LeT cadres in parachute jumping. It is learnt that LeT is trying to procure equipment for paragliding from companies in China and UAE, besides falling back on in house Pakistani companies to purchase the technology to build drones. In December 2014, intelligence inputs had indicated that LeT had paragliders ready to operate at two weeks notice. The agencies, in investigations carried out in Spain, learnt that a motorized paraglider with a capacity to carry two persons was to be procured for PKR 10,00,000. The equipment could carry a payload of 150 kilogram and cover a distance of nearly 70 kilometre. Tara tasked one Gajinder Singh to receive the paragliding equipment in Pakistan. Spanish authorities confirmed that Spain resident Muhammad Umar Gondal had purchased a para motor from a paraglider store in Costa de Sol area, mentioning an address in Sargodha, Pakistan, in the invoice. Gondal took the paraglider to Pakistan on June 30, 2014, when he claimed VAT refund on it. As per the plan, the paraglider was to be launched from Narowal area of Pakistan s Punjab during dusk time, with the intention of dropping the consignment into Indian territory. The paraglider would then make a return sortie, with the propeller fan switched off at a safe distance to avoid alerting the border agencies.
55641	2011	6	india	according to highly placed sources in the Indian intelligence agencies, the Students Islamic Movement of India (SIMI) and the Communist Party of India Maoist (CPI Maoist) have recently conducted a secret meeting in Kottayam District of Kerala. The meeting was to formulate strategies for a joint action in Kerala. While both the groups had earlier met in Palakkad, this is the first time that such a meeting has taken place in central Kerala, sources pointed out. Intelligence officials, who were tracking the movements of a couple who are allegedly leading the underground Maoist movement in Kerala, have found that SIMI cadres were actually entering into some pact with the Maoists. The intelligence agencies are trying to find out as to what sort of understanding the two groups have.
