index	year	month	location	news
8714	2015	8	pakistan	Death row prisoner Shafqat Hussain was hanged to death at the Karachi Central Prison on August 4 (today), after his hanging was postponed on four previous occasions this year, reported Dawn. Shafqat was arrested and sentenced to death in 2004 for the kidnapping and involuntary murder of a seven year old boy who lived in a Karachi apartment building where Shafqat worked as a security guard. All courts had turned down his appeals and the Supreme Court threw out a review petition that was the first to raise the matter of Shafqat’s juvenility at the time of arrest, maintaining that this line of defence should have been introduced at the trial court level.
29181	2013	9	india	On September 1, unidentified assailants hurled two petrol bombs at a Central Reserve Police Force (CRPF) camp at Mawlai Iewrynghep (Bridge) in Shillong city in East Khasi Hills District, reports The Shillong Times. No one was injured in the attack.
18097	2014	11	india	Three militants were killed in a gun battle in Tral town of Pulwama District on November 20, reports Daily Excelsior. Police said that Army and Special Operations Group (SOG) of Police laid an ambush near Jammu and Kashmir Bank in Tral Town following the specific information about the movement of militants in the area. The deceased militants were identified as Shiraz Ahmad, Asif Ahmad and Riyaz Gojjar. One SLR, one carbine, one pistol, grenades and other ammunition were recovered from the slain militants. However, the outfit to which they belonged is not known.
969	2015	1	india	Lieutenant General Subrata Saha, General officer commanding (GOC) of the Srinagar based 15 Corps said that Indian troops have been ordered not to react to cross border shelling or firing immediately but wait for targets to show, reports Times of India on January 10 (today). He said After all, we have no plans to fight a war so it s no use aimlessly shelling or firing across the Line of Control (LoC). The troops simply stay put while the firing continues and then maintain strict vigil through night vision equipment if necessary. Whenever a target presents itself, it is neutralized. This has yielded good results. After all, it s better to strike where it hurts.
61418	2011	7	pakistan	An unnamed senior Government official said that the militants, who abducted two Swiss tourists from Killi Nigah area in Loralai District of Balochistan on July 1, had taken them to a neighbouring South Waziristan. Officials in the neighbouring South Waziristan tribal area have been asked to keep an eye out for “suspicious elements,” said Balochistan Home Secretary Zafarullah Baloch. “Tribesmen in both areas have also been asked for help,” he said. “The five gunmen were speaking Pashto and drove off with the pair in a green car across the Zhob area of Balochistan and eventually into South Waziristan,” said Zafarullah Baloch.
63019	2011	11	pakistan	A video of November 11, 2010 suicide attack on a CID office building in Karachi was released showing three young men being trained, filming their target, the heavily guarded premises, and appearing before the camera for interviews before carrying out the attack. The 15 minute video has been produced by ‘Umer Studio’, said to be the media wing of the Tehreek e Taliban Pakistan (TTP), and posted by the Global Islamic Media Front on different websites. The focus is on the three youngsters engaged in armed training at an unspecified place. They appear before the camera one by one and describe their motive. The video with voiceover explains the reasons for the attack. The voiceover says “Under the designed plan, Rahmanullah and Farmanullah destroyed the security arrangements through firing and hand grenade attacks and Khan Mohammad drove the explosives laden truck into the CID building that brought the structure down. It was in revenge for killings of Islamic scholars, clerics and cruelty against mujahideen.”
6916	2015	12	india	A group of suspected Communist Party of India Maoist (CPI Maoist) cadres attacked forest outposts in Pookottumpadam under Nilambur south forest division in Malapuram District and Silent Valley outpost in Palakkad forest area of Palakkad District and abducted three persons including two forest officials on December 18 night, reports The Times of India. According to the forest officials the abducted persons were later released. The suspected group attacked the outpost which is located inside the Nilambur forest, around 15 kilometres away from the Pookottumpadam town. After setting the outpost ablaze the gang abducted five persons including four staff and one local person from Pookkottumpadam outpost. Though two forest staff managed to escape from their custody, other two forest watchers and the local man were taken to deep forest area by Maoist the gang. After keeping them in custody for one hour they were released. District Forest officer (DFO) of Nilambur South Saji said that the role of Maoist gang in the abduction and attack was confirmed.
59502	2011	12	india	Three persons were arrested with pistols and a country made rifle meant for the Communist Party of India Maoist (CPI Maoist) from Mohraun village in Rohtas District on December 28, reports IBN Live. Acting on a tip off, the Police raided the village and arrested Rashid Ansari alias Pillu, Mahaboob Ansari and Multan Ansari, Superintendent of Police Manu Maharaj said. Nine pistols and a rifle were recovered from them, he said. Inquiry revealed that the weapons were manufactured at Garhwa District in Jharkhand and were meant for Maoists operating in Rohtas District.
52190	2012	12	nepal	The Nepali Congress (NC) on December 5 proposed the party´s president, Sushil Koirala, as its candidate for the post of Prime Minister (PM) in a new, election Government, reports myrepublica.com. Unified Communist Party of Nepal Maoist (UCPN M) and Communist Party of Nepal Unified Marxist Leninist (CPN UML) leaders at the four party negotiations on December 4 had urged NC leaders to come up with their candidate. The NC decision comes a day before the expiry of the extended deadline given by the president to political parties to find a common candidate to head a national unity Government. The extended deadline will expire on December 6 (today).
9076	2015	9	pakistan	Six officials of Balochistan Development Authority (BDA), who were abducted on September 14, 2015 from Qilla Saifullah District, were recovered from Sharan area of Paktika Province in Afghanistan on September 17, reported Dawn. Family members of the kidnapped individuals said that tribesmen in Paktika played a vital role in the safe recovery of the individuals. They were brought to the residence of a local tribal elder, Azam Khan.
56093	2011	7	india	Times of India reports that the Security Force (SF) during an between July 4 6in the Sarju Gotag hills axis under Latehar Police Station neutralised a training camp of the Communist Party of India Maoist (CPI Maoist) in Koel Sank Zone and recovered Improvised Explosive Device (IED) and indigenous arms factories spread over an area of two square kilometres. The SF also recovered around three tones of explosives, chemicals and parts of weapons. The recoveries also included books on making IEDs, chemical formulas and over 20 sacks of ammonium nitrates and other materials. The SFs also recovered a blueprint of May 3, 2011 Lohardaga serial IED blasts in which 11 Police personnel were killed. The blueprint was recovered from the indigenous IED factory where real time testing of explosives was done, said Jharkhand Police spokesperson S. N. Pradhan. The camp, considered the backbone of Naxalism Left Wing Extremism (LWE) in Bihar and Jharkhand, often remained guarded with over 100 Maoists and more than 500 IED were planted on the routes to the camp. The camp which falls under the Koel Sankh Zone, and spreads through Palamu, Garhwa, Latehar, Lohardaga, Gumla, Gaya, Aurangabad and Northern Districts of Chhattisgarh is considered the richest of the Maoists zones in Bihar and Jharkhand.
22451	2014	4	nepal	The UCPN M during a meeting of the party s office bearers held in Kathmandu on April 15 announced nationwide protest programs against the Government move to lodge cases against its cadres implicated in the murder of Krishna Prasad Adhikari, reports Nepal News. The party would organize a corner assembly in Chitwan District on April 15. Similarly, the party will organize a rally and hold a corner assembly in Gorkha District on April 16 (today), while it will organize nationwide protests against the Government move on April 17. The meeting also decided to postpone and changed the venue of the national conference earlier scheduled to be held in Kathmandu to Biratnagar in Morang District.
18516	2014	12	india	Suspected hill based armed militants on December 8 kidnapped a survey engineer, involved in the construction of the Imphal Jiribam rail line, identified as Sandip Vera, and a supplier, identified as Shiv Singh Rana, from Tunnel No 2 at Kulbung in Churachandpur District, reports Kanglaonline. Sources said the two were kidnapped while returning from Thingtubung by around five tribal dialect speaking armed militants. Although the reason behind their kidnapping is yet to be confirmed it is suspected to be connected with a monetary demand.
46535	2012	3	pakistan	Two alleged militants were arrested from the basement of a mosque during an operation in Malgeen area of Lachi tehsil (revenue unit) in Kohat District, reports Dawn. The arrested militants were identified as Haji Mohammad and Noor Nawaz. Police recovered a small machine gun, a set of goggles, two hand grenades and surgical equipment from their possession.
51154	2012	12	pakistan	Two Muttahida Qaumi Movement (MQM) activists were shot dead in the remit of the Napier Police Station in Karachi, the provincial capital of Sindh, reports Dawn. Police said that the two men were passing through the Old Haji Camp on Syed Mehmood Shah Road on a motorbike when they were targeted in a drive by shooting. The victims were identified as Mohammad Asif and Mohammad Owais, MQM activists of the party’s Lyari sector.
23223	2014	9	srilanka	Sri Lanka Police have uncovered vital information about individuals who were involved in giving LKR 202 million from the Kandy Trinity College funds to the Liberation Tigers of Tamil Eelam (LTTE), reports Colombo Page on September 20. Police Media Spokesman Senior Superintendent of Police (SSP) Ajith Rohana said investigations will continue on the available information to arrest the suspects. According to report, an old Trinitian Nishantha Priyalal Alwis has filed a complaint regarding the donation and an audit report on the college funds to the Police. The complainant has said that a sum of money had been donated to the LTTE during the tenure of a former Trinity College principal Rod Gilbert and Gilbert was deported after his connection with the LTTE was proven before the court. Alwis in his complaint also said that a teacher and 11 students attached to Kandy Trinity College were arrested on suspicion of their connection with the LTTE. Police and Criminal Investigation Department (CID) are continuing further investigations.
6515	2015	11	india	An Army soldier was killed when militants opened firing on a patrol party of the troops in forward area of Pokhra near Kalaal in Nowshera sector of Rajouri District on November 23, reports Daily Excelsior. The militants reportedly wanted to infiltrate into the Indian Territory but their attempt failed. Official sources said an Army soldier identified as Sepoy Subinesh, a resident of village Cheliya in Kozhikode District of Kerala, was deployed in forward area of Pokhra, Kalaal in Nowshera sector along the Line of Control (LoC) when suspected militants opened firing on the troops causing serious injuries to Subinesh. Troops evacuated the injured trooper to the hospital, where he succumbed to his injuries.
4437	2015	7	india	Security Forces (SFs), in an encounter, killed a suspected IK Songbijit faction of National democratic Front of Bodoland (NDFB IKS) militant at Amteka in Chirang District on July 21, reports The Telegraph. The slain militant is yet to be identified. SFs recovered a .9mm pistol and two grenades from his possession.
324	2015	3	bangladesh	Two persons were injured during the Bangladesh Nationalist Party (BNP) led 20 party alliance s countrywide blockade as blockaders hurled crude bombs at TSC on Dhaka University campus in Dhaka city on March 23, reports The Daily Star. The injured persons are identified as Rehana Akhter and Sabbir.
45836	2012	1	pakistan	an Inspector of the Federal Investigation Agency (FIA), Walayat Hussain, Quetta television artiste Abid Hussain Nazish and Mohammad Anwar Hussain, an accounts officer at the Balochistan Accountant General’s Office, were shot dead on January 25 by unidentified armed assailants in a sectarian attack in Quetta. Police said it appeared to be a case of targeted sectarian killings because the victims were Shia who belonged to the Hazara tribe.
17267	2014	10	india	Further, the Bokaro Police, during a patrolling with the Central Reserve Police Force (CRPF), recovered arms and ammunition in a raid on an artificial Communist Party of India Maoist (CPI Maoist) bunker near Hadewe forest area at Jhumra hills in Gomia block under Mahuatand Police Station in Bokaro District on October 13, reports The Pioneer. The Bokaro Police and CRPF recovered 30 container bomb, 14 claymore bomb and huge others explosives from the artificial bunker.
61204	2011	6	pakistan	US on June 16 expressed apprehension that the nuclear weapons and technology of Pakistan might fall into the hands of terrorists and thus stressed on having the lines of communications open with Islamabad, reports Times of India. It s a country with an awful lot of terrorists on that border, Admiral Mike Mullen Chairman of the US Joint Chiefs of Staff, told reporters at a joint Pentagon news conference with the Defence Secretary, Robert Gates. Things that I fear in the future, it s the proliferation of that technology, and it s the opportunity and the potential that it could fall into the hands of terrorists, many of whom are alive and well and seek that in that region. And that s of great interest, I think, to our country and certainly to the rest of the world, Mullen said in response to a question.
20681	2014	7	pakistan	At least seven persons were killed in separate incidents of violence in Karachi (Karachi District), the provincial capital of Sindh on July 4, reports The News. Two suspected terrorists were killed and three others were injured when an Improvised Explosive Device (IED) they were carrying exploded in a motorcycle accident on New Preedy Street in Sadda.
40881	2012	5	india	A spokesman of little known militant group, Islamic Front (IF), owned responsibility for the May 30 attack and claimed that five Central Reserve Police Force (CRPF) personnel were injured in the attack. Security agencies suspected that the IF might be a shadow outfit of Lashkar e Toiba (LeT). Inspector General of Police (IGP, Kashmir) S M Sahai, said that this could be a handiwork of militant group that has come from outside Srinagar. However, sources said that their (militant) presence inside Srinagar can t be ruled out. They said that LeT is operating in small modules that are faceless. The module that has carried out the attack can be from inside Sriangar city but there is no such module that has come under the security forces radar , they added. As reported earlier, seven CRPF personnel were injured, one of them critically, as two motorcycle borne militants opened indiscriminate firing on them at Victory Crossing near Khanyar area of Srinagar on May 30.
57488	2011	9	india	The Hindu reports that a hardcore Communist Party of India Maoist cadre was arrested on September 7 in connection with the killing of Superintendent of Police, Surender Babu in Munger District six years back, Police said. Acting on a tip off, Police raided a place in Bhimbandh area of the District and captured Vishun Deo Dada alias Aghaura. Surender Babu was killed in a landmine blast triggered by Maoists in Bhimbandh on January 5, 2005. Aghaura was wanted in connection with the killing.
58372	2011	10	india	Suspected militants on October 26 hurled a grenade in Goriwan market in Bijbehara area of Anantnag District injuring five civilians, reports Times of India. The grenade exploded outside a shop resulting in injuries to five civilians. A passing Police vehicle was apparently the target of the attack but the grenade missed the vehicle, official sources said. No group has claimed responsibility for the attack.
24488	2013	1	india	Zeliangrong Students Union Manipur (ZSUM) called an indefinite blockade along National Highway (NH) 37, from January 1 midnight, reports Times of India. ZSUM called the blockade in protest against the alleged ‘fake encounter’ of a Zeliangrong United Front (ZUF) militant by Assam rifles (AR) troppers.ZSUM demanded that the government punish the guilty personnel under the Zeliangrong customary laws and removal of AR from the Noney area. AR in a statement said that on January 1 morning, around four ZUF militants opened fire at the forces and an encounter ensued, killing one cadre. The troops seized a .22 pistol with four bullets and 14 fired cases of AK 47 from the site. The slain cadre joined Nationalist Socialist Council of Nagaland Isak Muivah (NSCN IM) in 2006 and obtained training at Buning Camp, it said, adding that he deserted the outfit in 2011 and joined the ZUF and was operating under ‘captain’ Abung of ZUF.
57514	2011	9	india	The death toll in the blast at Delhi High Court on September 7 increased to 13 with the death of a 55 year old man on September 8, reports Times of India. The number of injured persons stands at 89.
43257	2012	9	india	A decomposed body of a villager who was reportedly missing since August 28 night was recovered on September 6, reports The Sentinel. The missing person has been identified as Krishna Kanta Boro (35), a resident of Teteli Bhanguri under Kalaigaon police station in Udalguri District. The recovery of the body led to tension in Udalguri as well as in neighbouring Darrang District. Police has arrested four persons in this connection.
34901	2013	10	pakistan	At least two gangsters, identified as Shahzad and Shakir, belonging to the Waseeullah alias Lakhoo group, were shot dead during a Police encounter in Kalri area of Lyari Town in Karachi District, the provincial capital of Sindh on October 6, reported The News. Kalri Station House Officer (SHO) Mir Mohammed Lashari said that the Police was informed about the presence of notorious criminals of Lyari gang war in the Daryabad area. Personnel from the City Division Police were called in and as the law enforcers were cordoning the entry and exit points, the gangsters opened fire at them. After a brief encounter, the Police arrested two injured gangsters but their accomplices fled under the cover of gunfire. Later, both of them succumbed to their injuries.
27907	2013	7	india	Odisha Police busted a Communist Party of India Maoist (CPI Maoist) camp near Patrapali village in Sonepur District following an encounter with the Maoists on July 2, reports The Hindustan Times. While a personnel of the state s elite anti Naxal Left Wing Extremist (LWE) Special Operations Group (SOG) was injured in the encounter, Police said some Maoists might have died. The Police recovered five guns, two grenades and some bombs from the camp deserted by Maoists after the encounter, said northern range Deputy Inspector General of Police (DIG), Sanjay Kumar, adding that some high profile Maoists were believed to be in the camp.
50590	2012	11	pakistan	Government’s allegations achieved little and the bench comprising Chief Justice Iftikhar Muhammad Chaudhry and Justice Jawwad S. Khawaja said the interim order remained intact. Federal Minister for Interior Rehman Malik also turned up in the court in defence of the Provincial Government. When the Minister tried to say that Balochistan was in grip of an insurgency, he was immediately contradicted. “It’s not insurgency, but lack of good governance,” the Chief Justice observed. The Chief Justice also asked the Interior Minister to read a confession in the court record in which a Provincial Minister had pointed a finger at his cabinet colleagues for their role in kidnapping for ransom. “Kidnappings have become a hot trade in the province,” the Chief Justice added. The court, however, ceded to a request of the Balochistan Government and adjourned the hearing for two weeks to enable it to do the needful
42696	2012	8	india	Unidentified militants hurled a grenade in the courtyard of the house of A. Mobi Singh, president of All Manipur Working Journalists’ Union (AMWJU), at Thongju Part II in Imphal East District on August 11, reports Sangai Express. No one was injured or killed in the attack.
45373	2012	12	india	Barring incidents of set ablaze of vehicles, Maoist activities have been contained to a large extent in Jharkhand, Director General of Police (DGP) GS Rath said in Jamshedpur, reports DNA. I do not claim that Maoist activities have been cleaned up in the State. The situation has improved to a great extent as we have been able to contain them, Rath told newsmen. Rath urged the Policemen to remain alert as the rebel outfits reply more on guerrilla tactics and can attack anywhere anytime.
16042	2014	8	india	Delhi Police believe they have quite a case in hand after probe revealed that a south Delhi firing on July 6 and an arms haul on August 11 in Dwarka could be related, The Times of India reports on August 18. Investigators have found that a blank shot fired in Vasant Vihar outside a colony housing Israeli and other foreign nationals, including some diplomats, may have come from the Dwarka haul. Therefore, they suspect the involvement of one gang or outfit in both cases. A terror probe is on the cards. Official sources confirmed that considering the threat to foreign nationals, including Israelis, the matter is being taken seriously and all possible involvements are being probed . Special cell s Anti Terror Unit and central intelligence agencies have been roped in as well. The Dwarka haul came from a parked car. Police didn t reveal much about it or the two men who were detained, save the fact that 200 dummy pistols and hundreds of blank cartridges were found in a gunny bag. The pistols were German made but their barrels had been blocked, rendering them unusable.
21475	2014	10	pakistan	During the quarter of a century between 1989 and 2014, more than 4,900 Pakistani citizens have perished in around 3,000 incidents of sectarian violence and close to 9,500 have sustained injuries, research conducted by The News reported on October 24. Approximately 525 Pakistanis had lost lives in 128 incidents of sectarian violence during 2013, 509 people had died unnaturally in 57 such incidents during 2010, as many as 507 humans (in 173 incidents) were made to travel towards their eternal abodes during 2012 because of their religious beliefs and 441 citizens had succumbed to this mode of terrorism in 341 incidents during 2007. More than 160 Pakistanis have fallen victim to the monster of sectarianism in well over five dozen incidents till date during the ongoing 2014. Following Wednesday’s unsuccessful suicide attack aimed at killing the Jamiat Ulema e Islam (JUI F) Chief Maulana Fazlur Rehman in Quetta, it is hence worthwhile to peek into the chronology and timeline of anti state violence, sectarian killings, election related feuds, tribal shootings, ethnicity and terrorism etc in Balochistan during the last 11 odd years. Research reveals at least 125 major incidents have rocked this unfortunate province since June 8, 2003, or the day when some 11 police trainees hailing from the Hazara Shia branch were shot dead at Quetta’s Sariab Road. While many residents of Balochistan have lost lives since 2003 after their vehicles had unfortunately hit land mines, even schools, hospitals, mosques and courts have not been spared by the merciless terrorists.
13372	2014	4	india	Two days after polling in Chhattisgarh s Bastar Lok Sabha constituency, the Communist party of India Maoist (CPI Maoist) struck twice in an hour on April 12, killing 15 people, including seven polling officials and six Central Reserve Police (CRPF) personnel, as they blew up a bus and an ambulance in Bijapur and Bastar Districts, reports The Times of India. Maoists first triggered a powerful blast, targeting a bus when a polling party was returning, between Kutru and Gudma in Bijapur District. Seven members of the polling party were killed in the blast and subsequent firing which also left five others injured. Sources said around 75 100 armed Maoists were involved in the ambush on the polling party. The Maoists fled to the forests after Security personnel launched a retaliatory attack.
19374	2014	2	pakistan	Four persons, including a supporter of the Muttahida Qaumi Movement (MQM), were killed in different parts of Karachi city (Karachi District) on February 15, reports Dawn. A young man identified as Arif Hanif (30), who had gone missing a couple of days back, was found shot dead in Manghopir. He was blindfolded and trussed up before being killed. The MQM, in a statement issued to the media later, claimed that he was their supporter. Meanwhile, two unidentified young men who looked Pakhtuns were found shot dead in Memon Goth. Four spent bullet casings fired from 9mm pistol were also found at the crime scene. The Memon Goth Police said the victims, in their mid 20s, had long beards. Separately, a vendor identified as Tanveer (50) was gunned down by assailants in Ranchhore Line Area. Police said that Tanveer was returning home with a pushcart when assailants attacked him and fled.
